9780241256718,DK Eyewitness Travel Guide Argentina: Eyewitness Travel Guide 2017,DK Travel,2017-02-01,4,41,5.857142857142857,0,623,In Print,0.0,0.0,,7.0,26.0,74.0,Low
9780241461501,DK Road Trips Germany: Plan with Ease - Explore with Confidence (Travel Guide),DK Travel,2022-05-26,4,39,5.857142857142857,1,65,In Print,0.0,0.0,,7.0,28.0,84.0,Low
9780241470848,DK Italian Riviera (Travel Guide),DK Travel,2024-05-02,4,27,6.0,1,1078,In Print,0.0,0.0,,5.0,18.0,58.0,Low
9780241619322,DK Washington DC (Travel Guide),DK Travel,2023-09-07,4,30,5.333333333333333,0,408,In Print,0.0,0.0,,6.0,24.0,77.0,Low
9780241633045,Seoul Like a Local: By the People Who Call It Home (Local Travel Guide),DK Travel,2023-10-05,4,16,5.666666666666667,2,182,In Print,0.0,0.0,,3.0,12.0,36.0,Low
9780241671825,DK Top 10 Montreal and Quebec City (Pocket Travel Guide),DK Travel,2024-07-04,4,71,6.6,1,1059,In Print,0.0,0.0,,10.0,37.0,114.0,Low
9780241462966,DK Eyewitness Top 10 Dubrovnik and the Dalmatian Coast: Top 10 Lists for Your Perfect Trip (Pocket Travel Guide),DK Travel,2022-05-26,4,71,14.4,0,0,Out of Print,0.0,0.0,,5.0,17.0,46.0,Low
9780241606056,Unforgettable Journeys Europe: Discover the Joys of Slow Travel,DK Travel,2023-03-02,4,91,12.0,0,1668,In Print,0.0,0.0,,8.0,28.0,78.0,Low
9780241677094,DK Top 10 Orlando (Pocket Travel Guide),DK Travel,2025-01-02,4,129,10.666666666666666,0,1279,In Print,0.0,0.0,,12.0,47.0,151.0,Low
9780241472194,DK Top 10 Provence and the Côte d'Azur (Pocket Travel Guide),DK Travel,2022-04-18,4,34,7.0,0,1033,In Print,0.0,0.0,,5.0,20.0,73.0,Low
9780241559277,Hike: Adventures on Foot,DK Travel,2022-05-05,4,50,15.666666666666666,0,604,In Print,0.0,0.0,,3.0,12.0,36.0,Low
9780241007006,DK Eyewitness Travel Guide Kenya: DK Eyewitness Travel Guide 2015,DK Travel,2015-10-01,4,13,1.7142857142857142,0,0,Out of Print,0.0,0.0,,7.0,25.0,72.0,High
9780241559246,Gardens of the World,DK Travel,2022-04-07,4,72,38.5,0,1523,In Print,0.0,0.0,,2.0,8.0,24.0,Low
9781464225963,Alpha Girl: A Werewolf Shifter Romance for Romantasy Lovers (Wolf Girl),DK Other,2024-12-10,4,26,5.2,0,956,In Print,0.0,0.0,,5.0,19.0,63.0,Low
9781647390983,"Understanding Body Language: How to Decode Nonverbal Communication in Life, Love, and Work",DK Other,2021-02-05,4,41,8.6,1,139,In Print,0.0,0.0,,5.0,20.0,61.0,Low
9781641526173,"Thriving with ADHD Workbook for Teens: Improve Focus, Get Organized, and Succeed",DK Other,2020-02-28,4,39,5.375,0,0,Reprinting,0.0,0.0,,8.0,32.0,91.0,Low
9781647391225,"30-Minute Drawing for Beginners: Easy Step-by-Step Lessons and Techniques for Landscapes, Still Lifes, Figures, and More",DK Other,2021-03-09,4,19,6.666666666666667,0,73,In Print,0.0,0.0,,3.0,9.0,25.0,Low
9781646113941,"Vegetarian Mediterranean Cookbook: 125+ Simple, Healthy Recipes for Living Well",DK Other,2020-02-14,4,47,8.333333333333334,0,48,In Print,0.0,0.0,,6.0,24.0,65.0,Low
9781728220130,The Haunting of Ashburn House,DK Other,2020-04-03,4,35,8.25,0,183,In Print,0.0,0.0,,4.0,16.0,47.0,Low
9781646111398,French Macarons for Beginners: Foolproof Recipes with 30 Shells and 30 Fillings,DK Other,2020-01-10,4,26,6.25,1,31,In Print,0.0,0.0,,4.0,16.0,47.0,Low
9781492656289,ABCs of Mathematics: 0 (Baby University),DK Other,2017-11-03,4,28,4.142857142857143,1,265,In Print,0.0,0.0,,7.0,28.0,87.0,Low
9781492642046,Shark Lady: The True Story of How Eugenie Clark Became the Ocean’s Most Fearless Scientist,DK Other,2017-07-06,4,27,3.857142857142857,0,372,In Print,0.0,0.0,,7.0,28.0,83.0,Low
9781464225956,Lost Girl: A Werewolf Shifter Romance for Romantasy Lovers (Wolf Girl),DK Other,2024-11-19,4,154,24.166666666666668,0,590,In Print,0.0,0.0,,6.0,24.0,77.0,Low
9781641526531,"The Vegan Ketogenic Diet Cookbook: 75 Satisfying High Fat, Low Carb, Dairy Free Recipes",DK Other,2020-03-11,4,7,3.5,1,101,In Print,0.0,0.0,,2.0,8.0,24.0,Low
9781728293813,2025 Great Quotes From Great Women Boxed Calendar: Words from the Women Who Shaped the World,DK Other,2024-09-01,4,37,7.6,0,0,No Longer Distributed,0.0,0.0,,5.0,13.0,30.0,Low
9781641522410,"A Year of Positive Thinking: Daily Inspiration, Wisdom, and Courage (A Year of Daily Reflections)",DK Other,2019-01-11,4,25,9.0,0,56,In Print,0.0,0.0,,3.0,12.0,35.0,Low
9781648769450,How to Clicker Train Your Cat: A Step-by-Step Guide to Teaching New Skills and Fun Tricks in 15 Minutes a Day,DK Other,2021-07-01,4,0,0.0,0,0,Reprinting,0.0,0.0,,8.0,29.0,91.0,High
9781464227165,The Broken Vows (The Windsors),DK Other,2025-08-05,4,0,,0,0,NOT YET PUBLISHED,6.0,0.0,,0.0,0.0,6.0,Low
9781646111626,"Essential Art Therapy Exercises: Effective Techniques to Manage Anxiety, Depression, and PTSD",DK Other,2020-04-30,4,3,0.375,0,0,Reprinting,0.0,0.0,,8.0,32.0,92.0,High
9781728295404,Heavy Crown (Brutal Birthright),DK Other,2024-01-30,4,96,24.0,20,1777,In Print,0.0,0.0,,4.0,16.0,48.0,Low
9781464225970,Mated Girl: A Werewolf Shifter Romance for Romantasy Lovers (Wolf Girl),DK Other,2025-01-07,4,120,8.461538461538462,0,857,In Print,0.0,0.0,,13.0,47.0,131.0,Low
9781641525190,Stretching for Beginners: Improve Flexibility and Relieve Aches and Pains with 100 Exercises and 25 Simple Routines,DK Other,2019-12-19,4,14,7.5,0,76,In Print,0.0,0.0,,2.0,8.0,24.0,Low
9781728286792,Mercy (Salacious Players' Club),DK Other,2023-12-05,4,58,10.5,2,1846,In Print,0.0,0.0,,6.0,24.0,80.0,Low
9781728232522,The Science Spell Book: Magical Experiments for Kids,DK Other,2022-08-06,4,0,0.0,0,0,Reprinting,0.0,0.0,,37.0,147.0,477.0,High
9781728276533,"Girl Who Figured It Out, The: The Inspiring True Story of Wheelchair Athlete Minda Dentler Becoming an Ironman World Champion",DK Other,2024-04-05,4,12,1.2222222222222223,0,0,Reprint under Review,0.0,0.0,,9.0,29.0,76.0,High
9781641520904,"The Complete Guide to Pressure Canning: Everything You Need to Know to Can Meats, Vegetables, Meals in a Jar, and More",DK Other,2018-08-24,4,16,2.6666666666666665,0,0,Reprinting,0.0,0.0,,6.0,24.0,72.0,High
9781953424082,Rebel Girls Champions: 25 Tales of Unstoppable Athletes,DK Other,2021-09-21,4,192,23.25,0,1187,In Print,0.0,0.0,,8.0,30.0,98.0,Low
9781728266046,And There He Kept Her: A Novel,DK Other,2022-06-14,4,1,,2,295,In Print,0.0,0.0,,0.0,0.0,0.0,Low
9781641524391,How to Read Tarot: A Modern Guide,DK Other,2019-09-27,4,21,5.75,8,221,In Print,0.0,0.0,,4.0,13.0,38.0,Low
9781641524377,"Mindfulness for Teens in 10 Minutes a Day: Exercises to Feel Calm, Stay Focused & Be Your Best Self",DK Other,2019-10-24,4,32,4.714285714285714,0,0,Reprinting,0.0,0.0,,7.0,24.0,78.0,Low
9781728206141,Boyfriend Material: 2 (London Calling),DK Other,2020-08-07,4,81,7.454545454545454,0,1664,In Print,0.0,0.0,,11.0,28.0,76.0,Low
9781728250168,There Was a Black Hole that Swallowed the Universe,DK Other,2021-09-16,4,43,6.714285714285714,0,63,In Print,0.0,0.0,,7.0,24.0,72.0,Low
9781953424716,"Growing Up Powerful Journal: A Confidence Boosting, Totally Inspiring, Joyful Journal",DK Other,2023-10-10,4,44,15.666666666666666,0,1797,In Print,0.0,0.0,,3.0,12.0,36.0,Low
9781464231667,Night of the Witch (Witch and Hunter),DK Other,2024-04-16,4,33,16.5,0,767,In Print,0.0,0.0,,2.0,9.0,32.0,Low
9781728284248,Honey Cut (Lyonesse),DK Other,2024-06-18,4,119,30.25,0,1609,In Print,0.0,0.0,,4.0,13.0,38.0,Low
9781953424426,Rebel Girls Animal Allies: 25 Tales of Women Working with Wildlife,DK Other,2023-04-04,4,37,8.0,0,921,In Print,0.0,0.0,,5.0,20.0,63.0,Low
9781464245077,My Fault (Deluxe Edition): The Beloved YA Enemies to Lovers Forbidden Romance - Now an Amazon Prime Original Movie! (Culpable),DK Other,2024-12-03,4,35,18.5,9,2705,In Print,0.0,0.0,,2.0,8.0,24.0,Low
9781623159634,Ayurveda Cooking for Beginners: An Ayurvedic Cookbook to Balance and Heal,DK Other,2018-03-20,4,33,7.0,5,9,In Print,0.0,0.0,,5.0,20.0,60.0,Low
9781728234076,Germ Theory for Babies: 1 (Baby University),DK Other,2021-03-02,4,46,10.5,0,295,In Print,0.0,0.0,,4.0,16.0,48.0,Low
9781464233906,Desperate Measures: A Dark Enemies to Lovers Romance Based on a Classic Tale (Wicked Villains),DK Other,2024-10-15,4,257,55.0,0,3119,In Print,0.0,0.0,,5.0,20.0,60.0,Low
9781939754448,"The Easy 5-Ingredient Ketogenic Diet Cookbook: Low-Carb, High-Fat Recipes for Busy People on the Keto Diet",DK Other,2018-02-09,4,14,2.142857142857143,0,0,Reprint under Review,0.0,0.0,,7.0,24.0,72.0,High
9780241621486,"What Every Parent Needs to Know: A Psychologist's Guide to Raising Happy, Nurtured Children",DK Life,2023-10-05,4,14,4.666666666666667,1,840,In Print,0.0,0.0,,3.0,12.0,36.0,Low
9780241510155,"Australian Women's Weekly Mediterranean: Fresh, Healthy Everyday Recipes",DK Life,2021-05-06,4,6,3.0,2,2701,In Print,0.0,0.0,,2.0,8.0,24.0,Low
9780241431825,Parkers' Astrology: The Definitive Guide to Using Astrology in Every Aspect of Your Life,DK Life,2020-09-03,4,106,16.333333333333332,0,704,In Print,0.0,0.0,,6.0,27.0,83.0,Low
9780241302071,Yin Yoga: Stretch the mindful way,DK Life,2018-01-04,4,56,5.9,3,842,In Print,0.0,1000.0,2025-04-14,10.0,36.0,116.0,Low
9780241388419,Eat Feel Fresh: A Contemporary Plant-based Ayurvedic Cookbook,DK Life,2019-07-04,4,65,10.333333333333334,0,348,In Print,0.0,0.0,,6.0,23.0,71.0,Low
9780241572993,"Kama Sutra Workout New Edition: Work Hard, Play Harder with 300 Sensual Sexercises",DK Life,2022-12-01,4,18,5.666666666666667,25,4466,In Print,0.0,1500.0,2025-01-21,3.0,12.0,34.0,Low
9780241593301,"How to Attract Wildlife to Your Garden: Foods They Like, Plants They Love, Shelter They Need",DK Life,2023-03-02,4,59,8.285714285714286,0,1279,In Print,0.0,0.0,,7.0,28.0,88.0,Low
9780241679562,"The Calligraphy Book: Pointed Pen Techniques, Inspiration, and Projects",DK Life,2024-11-07,4,130,17.125,0,358,In Print,0.0,1200.0,2025-02-12,8.0,27.0,82.0,Low
9780241318256,Canapés: Over 200 recipes and step-by-step guides,DK Life,2017-10-05,4,190,25.625,0,387,In Print,0.0,0.0,,8.0,32.0,110.0,Low
9780241558362,Rekha's Kitchen Garden: Seasonal Produce and Home-Grown Wisdom from One Gardener's Allotment Year,DK Life,2023-02-02,4,31,11.0,0,2627,In Print,0.0,0.0,,3.0,9.0,26.0,Low
9780241634158,Crochet Stitches Step-by-Step: More than 150 Essential Stitches for Your Next Project,DK Life,2023-12-07,4,71,9.625,0,1375,In Print,0.0,0.0,,8.0,31.0,87.0,Low
9780241680353,It's Not That Radical: Climate Action to Transform Our World,DK Life,2024-04-18,4,34,6.8,0,401,In Print,0.0,0.0,,5.0,20.0,59.0,Low
9780241674888,"Manga Drawing School: Take Your Art to the Next Level, Step-by-Step",DK Life,2024-08-01,4,57,14.25,0,1421,In Print,0.0,0.0,,4.0,16.0,47.0,Low
9780241636251,"Artist's Drawing Techniques: Discover How to Draw Landscapes, People, Still Lifes and More, in Pencil, Charcoal, Pen and Pastel",DK Life,2023-08-03,4,61,6.222222222222222,0,667,In Print,0.0,0.0,,9.0,32.0,90.0,Low
9780241217429,The Bee Book: The Wonder of Bees – How to Protect them – Beekeeping Know-how,DK Life,2016-03-01,4,56,11.0,0,756,In Print,0.0,0.0,,5.0,20.0,68.0,Low
9780241593370,Encyclopedia of Herbal Medicine New Edition: 560 Herbs and Remedies for Common Ailments,DK Life,2023-06-01,4,363,29.23076923076923,0,2079,In Print,0.0,0.0,,13.0,48.0,153.0,Low
9780241557105,Malt Whisky Companion,DK Life,2022-08-04,4,113,10.090909090909092,0,777,In Print,0.0,0.0,,11.0,36.0,108.0,Low
9780241239124,RHS A-Z Encyclopedia of Garden Plants 4th edition: (New Edition),DK Life,2016-09-01,4,58,14.25,0,289,In Print,0.0,0.0,,4.0,16.0,48.0,Low
9780241667118,The Seed Hunter: Discover the World's Most Unusual Heirloom Plants,DK Life,2024-10-03,4,224,56.25,0,4554,In Print,0.0,0.0,,4.0,16.0,43.0,Low
9780241634530,A Kids Book About Racism,DK Licensing,2023-07-06,4,29,6.75,0,1489,In Print,0.0,0.0,,4.0,16.0,48.0,Low
9780241554685,"Mrs Wordsmith Year 4 English Humungous Workbook, Ages 8–9 (Key Stage 2): with 3 months free access to Word Tag, Mrs Wordsmith's fun-packed, vocabulary-boosting app!",DK Licensing,2022-05-05,4,27,3.111111111111111,0,960,In Print,0.0,0.0,,9.0,33.0,94.0,Low
9780241559222,The Ultimate Avatar Sticker Book: Includes Avatar The Way of Water,DK Licensing,2022-12-16,4,28,8.666666666666666,0,462,In Print,0.0,0.0,,3.0,12.0,37.0,Low
9780241554692,"Mrs Wordsmith Year 5 English Stupendous Workbook, Ages 9–10 (Key Stage 2): with 3 months free access to Word Tag, Mrs Wordsmith's fun-packed, vocabulary-boosting app!",DK Licensing,2022-05-05,4,26,4.5,0,440,In Print,0.0,0.0,,6.0,20.0,63.0,Low
9780241593424,DK Super Readers Level 1 Star Wars Grogu's Galaxy: Meet Mando's New Friend!,DK Licensing,2023-03-02,4,47,15.333333333333334,3,536,In Print,0.0,0.0,,3.0,16.0,45.0,Low
9780241506271,How to Build LEGO Houses: Go on a Journey to Become a Better Builder,DK Licensing,2021-10-07,4,46,4.8,0,757,In Print,0.0,0.0,,10.0,37.0,120.0,Low
9780241199312,LEGO DC Super Heroes Character Encyclopedia: Includes Exclusive Pirate Batman Minifigure (DK Lego),DK Licensing,2016-04-01,4,40,19.0,0,0,Out of Print,0.0,0.0,,2.0,8.0,24.0,Low
9780241469347,LEGO Super Nature: Includes Four Exclusive LEGO Mini Models,DK Licensing,2021-06-03,4,46,24.0,0,3321,In Print,0.0,0.0,,2.0,8.0,31.0,Low
9780241409190,LEGO Epic History: Includes Four Exclusive LEGO Mini Models,DK Licensing,2020-05-07,4,25,25.0,0,1901,In Print,0.0,0.0,,1.0,7.0,23.0,Low
9780241620120,How to Build LEGO Animals: Go on a Journey to Become a Better Builder,DK Licensing,2023-08-03,4,64,11.333333333333334,0,1213,In Print,0.0,0.0,,6.0,23.0,77.0,Low
9780241439531,The DC Comics Encyclopedia New Edition,DK Licensing,2021-07-01,4,74,24.666666666666668,0,1232,In Print,0.0,0.0,,3.0,13.0,45.0,Low
9780241313824,LEGO Star Wars Choose Your Path: Includes U-3PO Droid Minifigure,DK Licensing,2018-06-07,4,100,11.0,0,627,In Print,0.0,0.0,,10.0,37.0,113.0,Low
9780241531525,Star Wars The Mandalorian Ultimate Sticker Collection,DK Licensing,2022-02-03,4,47,12.25,0,1722,In Print,0.0,0.0,,4.0,15.0,46.0,Low
9780241662809,Draw with Art for Kids Hub Cute and Funny Foods,DK Licensing,2024-07-04,4,198,12.5625,1,577,In Print,0.0,0.0,,16.0,60.0,203.0,Low
9780241275146,English for Everyone Business English Course Book Level 2: A Complete Self-Study Programme,DK Learning,2017-01-16,4,82,20.75,0,768,In Print,0.0,0.0,,4.0,16.0,48.0,Low
9780241491416,"German for Everyone Junior 5 Words a Day: Learn and Practise 1,000 German Words",DK Learning,2021-07-01,4,36,5.428571428571429,17,1328,In Print,0.0,964.0,2025-01-31,7.0,25.0,76.0,Low
9780241566183,"Spanish English Illustrated Dictionary: A Bilingual Visual Guide to Over 10,000 Spanish Words and Phrases",DK Learning,2023-06-01,4,94,8.454545454545455,0,2584,In Print,0.0,2000.0,2025-01-23,11.0,40.0,120.0,Low
9780241601488,"German English Illustrated Dictionary: A Bilingual Visual Guide to Over 10,000 German Words and Phrases",DK Learning,2023-06-01,4,129,12.818181818181818,0,1527,In Print,0.0,1500.0,2025-01-15,11.0,39.0,111.0,Low
9780241601471,"French English Illustrated Dictionary: A Bilingual Visual Guide to Over 10,000 French Words and Phrases",DK Learning,2023-06-01,4,73,9.625,2,1321,In Print,0.0,0.0,,8.0,29.0,95.0,Low
9780241242346,English for Everyone Business English Course Book Level 1: A Complete Self-Study Programme,DK Learning,2017-01-16,4,101,32.333333333333336,0,708,In Print,0.0,0.0,,3.0,12.0,36.0,Low
9780241712634,DK Super Phonics A Parent's Guide to Phonics: Understanding How to Help Your Child with Reading and Spelling,DK Learning,2024-09-05,4,46,14.333333333333334,0,1045,In Print,0.0,0.0,,3.0,12.0,35.0,Low
9780241426456,Anatomy for the Artist,DK Knowledge,2020-01-02,4,73,11.571428571428571,0,1186,In Print,0.0,0.0,,7.0,24.0,70.0,Low
9780241515792,Essential Managers Management Handbook (DK Essential Managers),DK Knowledge,2022-06-02,4,110,17.428571428571427,0,406,In Print,0.0,2000.0,2025-03-21,7.0,28.0,84.0,Low
9780241446324,How Space Works: The Facts Visually Explained (How Things Work),DK Knowledge,2021-03-04,4,28,10.333333333333334,0,2095,In Print,0.0,0.0,,3.0,8.0,31.0,Low
9780241409688,The Islam Book: Big Ideas Simply Explained,DK Knowledge,2020-07-30,4,25,5.75,0,1412,In Print,0.0,0.0,,4.0,16.0,48.0,Low
9780241566275,Complete Horse Riding Manual (DK Complete Manuals),DK Knowledge,2023-02-02,4,18,4.5,5,228,In Print,0.0,0.0,,4.0,16.0,48.0,Low
9780241569498,Habitats: Discover Earth's Precious Wild Places,DK Knowledge,2023-10-05,4,136,20.142857142857142,0,1216,In Print,0.0,0.0,,7.0,28.0,85.0,Low
9780241694176,Simply AI: Facts Made Fast (DK Simply),DK Knowledge,2024-03-07,4,55,8.833333333333334,8,3046,In Print,0.0,1688.0,2025-03-20,6.0,20.0,60.0,Low
9780241437414,Art: A Visual History,DK Knowledge,2020-05-07,4,49,9.0,1,2122,In Print,0.0,0.0,,5.0,20.0,59.0,Low
9781409324911,The Religions Book: Big Ideas Simply Explained (DK Big Ideas),DK Knowledge,2013-08-01,4,44,4.7,1,1101,In Print,0.0,0.0,,10.0,37.0,109.0,Low
9780241515754,Timelines of World History (DK Timelines),DK Knowledge,2022-05-05,4,109,14.714285714285714,0,0,Reprinting,0.0,0.0,,7.0,28.0,90.0,Low
9780241302293,"Help Your Kids with Computer Science (Key Stages 1-5): A Unique Step-by-Step Visual Guide to Computers, Coding, and Communication (DK Help Your Kids With)",DK Knowledge,2018-07-05,4,22,4.8,2,485,In Print,0.0,0.0,,5.0,16.0,50.0,Low
9780241471432,Fossils (DK Handbooks),DK Knowledge,2021-10-07,4,69,12.0,0,1192,In Print,0.0,0.0,,6.0,20.0,67.0,Low
9780241364246,Encyclopedia of Aquarium and Pond Fish,DK Knowledge,2019-02-07,4,59,10.0,0,282,In Print,0.0,0.0,,6.0,20.0,60.0,Low
9780241298824,Engineers: From the Great Pyramids to Spacecraft,DK Knowledge,2017-04-03,4,77,5.0,0,0,Reprinting,0.0,1500.0,2025-03-28,14.0,50.0,143.0,Low
9780241566237,The Poetry Book: Big Ideas Simply Explained (DK Big Ideas),DK Knowledge,2023-09-21,4,43,7.666666666666667,2,1997,In Print,0.0,0.0,,6.0,21.0,67.0,Low
9780241515549,The Chemistry Book: Big Ideas Simply Explained (DK Big Ideas),DK Knowledge,2022-07-07,4,87,8.4,0,1807,In Print,0.0,0.0,,10.0,36.0,112.0,Low
9780241387054,Myths & Legends: An illustrated guide to their origins and meanings,DK Knowledge,2019-06-06,4,107,13.5,0,1552,In Print,0.0,930.0,2025-04-01,8.0,27.0,79.0,Low
9780241668870,Ancient Greece: The Definitive Visual History (DK Classic History),DK Knowledge,2025-04-17,4,0,0.0,0,0,NOT YET PUBLISHED,90.0,5000.0,2025-03-06,10.0,61.0,959.0,High
9780241487372,"The Big Quiz Book: 10,000 amazing general knowledge questions",DK Knowledge,2020-07-30,4,131,13.555555555555555,0,1099,In Print,0.0,0.0,,9.0,32.0,98.0,Low
9780241446331,Science: The Definitive Visual Guide,DK Knowledge,2021-09-02,4,48,17.0,0,458,In Print,0.0,1500.0,2025-02-14,3.0,13.0,44.0,Low
9781409341260,The Business Book: Big Ideas Simply Explained (DK Big Ideas),DK Knowledge,2014-02-03,4,92,14.5,2,3103,In Print,0.0,4000.0,2025-03-31,6.0,24.0,81.0,Low
9780241617199,Planets: DK Eyewitness,DK Childrens 9+,2023-04-06,4,53,6.333333333333333,0,1663,In Print,0.0,0.0,,9.0,33.0,95.0,Low
9780241539811,Volcano & Earthquake: DK Eyewitness,DK Childrens 9+,2022-04-07,4,23,6.0,2,436,In Print,0.0,0.0,,4.0,16.0,45.0,Low
9780241240434,The Periodic Table Book: A Visual Encyclopedia of the Elements,DK Childrens 9+,2017-03-30,4,221,11.882352941176471,0,232,In Print,0.0,3844.0,2025-03-17,17.0,66.0,194.0,Low
9780241569849,Amazon: DK Eyewitness,DK Childrens 9+,2022-12-01,4,73,12.333333333333334,0,1468,In Print,0.0,0.0,,6.0,22.0,70.0,Low
9780241636022,What's Where on Earth? History Atlas: History as You've Never Seen it Before (DK Where on Earth? Atlases),DK Childrens 9+,2023-03-02,4,31,4.428571428571429,0,708,In Print,0.0,0.0,,7.0,24.0,72.0,Low
9780241257265,How to Play Chess,DK Childrens 9+,2016-10-06,4,23,4.6,0,1138,In Print,0.0,0.0,,5.0,16.0,48.0,Low
9780241364970,"How to be Good at English, Ages 7-14 (Key Stages 2-3): The Simplest-ever Visual Guide (DK How to Be Good at)",DK Childrens 9+,2022-07-07,4,38,5.833333333333333,0,659,In Print,0.0,1500.0,2025-03-03,6.0,21.0,68.0,Low
9780241426364,Space: a children's encyclopedia,DK Childrens 9+,2020-08-06,4,18,5.0,0,527,In Print,0.0,1440.0,2025-03-17,4.0,12.0,37.0,Low
9780241206553,All About Physics,DK Childrens 9+,2015-09-01,4,133,16.75,0,29,In Print,0.0,1000.0,2025-03-10,8.0,28.0,87.0,Low
9780241286869,Computer Coding Python Projects for Kids: A Step-by-Step Visual Guide (DK Help Your Kids With),DK Childrens 9+,2017-06-01,4,79,7.636363636363637,1,339,In Print,0.0,0.0,,11.0,39.0,113.0,Low
9780241681473,Children's Book of Philosophy (DK Children's Book of),DK Childrens 9+,2024-09-05,4,33,10.666666666666666,0,1135,In Print,0.0,1000.0,2025-02-03,3.0,8.0,32.0,Low
9780241343692,Pocket Eyewitness Science: Facts at Your Fingertips,DK Childrens 9+,2018-05-03,4,36,5.142857142857143,1,1372,In Print,0.0,1500.0,2025-01-31,7.0,27.0,80.0,Low
9780241656938,Supernatural Creatures: Mythical and Sacred Creatures from Around the World,DK Childrens 9+,2024-08-01,4,104,14.0,0,733,In Print,0.0,0.0,,7.0,23.0,68.0,Low
9780241515341,Extraordinary Dinosaurs and Other Prehistoric Life Visual Encyclopedia (DK Children's Visual Encyclopedia),DK Childrens 9+,2022-12-01,4,146,20.428571428571427,0,1915,In Print,0.0,0.0,,7.0,26.0,80.0,Low
9780241515358,Timelines of Science: From Fossils to Quantum Physics (DK Children's Timelines),DK Childrens 9+,2022-10-06,4,30,7.25,1,1382,In Print,0.0,0.0,,4.0,12.0,40.0,Low
9780241343685,Pocket Eyewitness Insects: Facts at Your Fingertips,DK Childrens 9+,2018-05-03,4,151,12.23076923076923,0,1496,In Print,0.0,0.0,,13.0,52.0,170.0,Low
9780241607558,"1,000 Amazing Weird Facts (DK 1,000 Amazing Facts)",DK Childrens 9+,2023-10-05,4,1,,0,830,In Print,0.0,0.0,,0.0,0.0,2.0,Low
9780241364369,Knowledge Encyclopedia Dinosaur!: Over 60 Prehistoric Creatures as You've Never Seen Them Before (Knowledge Encyclopedias),DK Childrens 9+,2019-10-03,4,1016,31.862068965517242,0,2180,In Print,0.0,2000.0,2025-01-31,29.0,127.0,457.0,Low
9781409344704,English Made Easy Early Writing Ages 3-5 Preschool (Made Easy Workbooks),DK Children 0-9,2014-07-01,4,48,7.833333333333333,0,1058,In Print,0.0,0.0,,6.0,24.0,79.0,Low
9780241184950,Easy Peasy Chinese Workbook: Mandarin Chinese Practice for Beginners,DK Children 0-9,2015-08-03,4,9,0.6,0,1335,In Print,0.0,1500.0,2025-02-03,15.0,62.0,180.0,Low
9780241491591,My First Dinosaur Flash Cards,DK Children 0-9,2021-10-14,4,20,4.4,1,1198,In Print,0.0,0.0,,5.0,19.0,56.0,Low
9780241318683,"DKfindout! Maya, Incas, and Aztecs",DK Children 0-9,2018-07-05,4,68,6.7,0,1237,In Print,0.0,1000.0,2025-01-21,10.0,36.0,110.0,Low
9780241250242,DKfindout! Volcanoes,DK Children 0-9,2016-07-01,4,117,7.6,0,744,In Print,0.0,0.0,,15.0,50.0,138.0,Low
9781409344643,"English Made Easy, Ages 5-6 (Key Stage 1): Supports the National Curriculum, English Exercise Book (Made Easy Workbooks)",DK Children 0-9,2014-07-01,4,55,8.0,0,732,In Print,0.0,1500.0,2025-04-07,7.0,28.0,84.0,Low
9780241273135,Baby Touch and Feel: Puppies,DK Children 0-9,2017-01-16,4,28,4.285714285714286,1,1775,In Print,0.0,0.0,,7.0,28.0,86.0,Low
9780241467060,Ultimate Sticker Book Sharks,DK Children 0-9,2021-05-06,4,11,4.0,0,1255,In Print,0.0,0.0,,3.0,12.0,36.0,Low
9780241467077,Ultimate Sticker Book Bugs,DK Children 0-9,2021-01-07,4,81,5.769230769230769,1,1714,In Print,0.0,0.0,,13.0,51.0,184.0,Low
9780241420256,"I Am, I Can: 365 affirmations for kids (Mindfulness for Kids)",DK Children 0-9,2020-08-06,4,4,4.0,1,835,In Print,0.0,0.0,,1.0,4.0,12.0,Low
9781409346661,Baby Touch and Feel Farm Friends,DK Children 0-9,2014-01-16,4,20,21.0,0,1029,In Print,0.0,0.0,,1.0,4.0,12.0,Low
9780241474112,How To Be An Artist (Careers for Kids),DK Children 0-9,2021-06-03,4,22,24.0,0,171,In Print,0.0,0.0,,1.0,4.0,12.0,Low
9780241379325,Rugby: Be on the Ball with the Greatest Game on Earth (My Book of Sports),DK Children 0-9,2019-08-01,4,87,11.625,0,1205,In Print,0.0,1000.0,2025-01-13,8.0,30.0,91.0,Low
9780241633335,From Plant to Plate: Turn Home-Grown Ingredients Into Healthy Meals!,DK Children 0-9,2024-05-02,4,8,8.0,0,502,In Print,0.0,0.0,,1.0,4.0,12.0,Low
9781409349471,"Spelling Made Easy, Ages 8-9 (Key Stage 2): Supports the National Curriculum, English Exercise Book (Made Easy Workbooks)",DK Children 0-9,2014-07-01,4,11,3.6666666666666665,0,422,In Print,0.0,0.0,,3.0,12.0,36.0,Low
9780241538500,Dinosaur Club: Saving the Stegosaurus,DK Children 0-9,2022-05-05,4,27,9.333333333333334,0,49,In Print,0.0,0.0,,3.0,12.0,39.0,Low
9780241645239,King Charles III: Celebrating His Majesty's Coronation and Reign (History's Great Leaders),DK Children 0-9,2023-03-02,4,216,103.0,0,6422,In Print,0.0,0.0,,2.0,8.0,24.0,Low
9780241689523,"An Anthology of Rocks and Minerals: A Collection of 100 Rocks, Minerals, and Gems from Around the World (DK's Little Anthologies)",DK Children 0-9,2024-10-03,4,140,45.0,0,2171,In Print,0.0,0.0,,3.0,12.0,37.0,Low
9780241323762,My Mixed Emotions: Learn to Love Your Feelings,DK Children 0-9,2018-08-02,4,8,2.6666666666666665,0,862,In Print,0.0,0.0,,3.0,8.0,30.0,Low
9780241316344,Baby Touch and Feel Baby Dinosaur,DK Children 0-9,2018-05-03,4,9,5.0,2,2737,In Print,0.0,0.0,,2.0,8.0,24.0,Low
9780241585214,My First Things That Go: Let's get moving! (My First Tabbed Board Book),DK Children 0-9,2025-01-02,4,8,4.0,1,3566,In Print,0.0,0.0,,2.0,6.0,21.0,Low
9780241395806,The Book of Brilliant Bugs (The Magic and Mystery of Nature),DK Children 0-9,2020-03-05,4,43,14.666666666666666,0,1298,In Print,0.0,0.0,,3.0,12.0,38.0,Low
9781409344810,"Maths Made Easy: Advanced, Ages 8-9 (Key Stage 2): Supports the National Curriculum, Maths Exercise Book (Made Easy Workbooks)",DK Children 0-9,2014-07-01,4,32,5.333333333333333,0,1128,In Print,0.0,1000.0,2025-01-21,6.0,24.0,74.0,Low
9780241502648,This Is How We Get Ready: For Little Kids Going To Big School (First Skills for Preschool),DK Children 0-9,2021-09-16,4,12,12.0,0,569,In Print,0.0,0.0,,1.0,4.0,20.0,Low
9780241412459,"RHS Under Your Feet: Soil, Sand and other stuff (Underground and All Around)",DK Children 0-9,2020-04-02,4,14,3.75,2,356,In Print,0.0,0.0,,4.0,16.0,48.0,Low
9781405362573,Baby Touch and Feel Tractor,DK Children 0-9,2011-01-20,4,27,4.5,0,1664,In Print,0.0,0.0,,6.0,24.0,79.0,Low
