9780241536285,Cat: DK Eyewitness,DK Childrens 9+,2022-04-07,1,22,10.0,0,100,In Print,0.0,500.0,2025-03-15,2.0,8.0,24.0,Low
9780241699270,Brain Booster Volcanoes and Earthquakes: Over 100 Mind-Boggling Activities that Make Learning Easy and Fun,DK Childrens 9+,2024-09-05,1,11,,0,1004,In Print,0.0,0.0,,0.0,0.0,0.0,Low
9780241525661,"English for Everyone Junior English Dictionary: Learn to Read and Say More than 1,000 Words",DK Childrens 9+,2021-12-09,1,35,32.0,0,1979,In Print,0.0,1500.0,2025-01-22,1.0,4.0,12.0,Low
9780241638699,Knowledge A Visual Compendium: Making Sense of our World,DK Childrens 9+,2024-09-12,1,109,121.0,0,6300,In Print,0.0,0.0,,1.0,5.0,18.0,Low
9780241355374,The Sea Book (Conservation for Kids),DK Children 0-9,2019-02-07,1,70,25.666666666666668,0,1071,In Print,0.0,1500.0,2025-01-15,3.0,21.0,94.0,Low
9781405336765,Baby Touch and Feel Baby Animals,DK Children 0-9,2010-01-14,1,24,3.5714285714285716,0,2238,In Print,0.0,0.0,,7.0,51.0,213.0,Low
9780241459140,Earth's Incredible Oceans (The Magic and Mystery of Nature),DK Children 0-9,2021-04-01,1,28,7.25,0,628,In Print,0.0,0.0,,4.0,16.0,48.0,Low
9780241414767,Yoga For Kids: Simple First Steps in Yoga and Mindfulness (Mindfulness for Kids),DK Children 0-9,2020-05-07,1,14,5.0,0,198,In Print,0.0,0.0,,3.0,12.0,36.0,Low
9780241427811,My Encyclopedia of Very Important Adventures: For little learners who love exciting journeys and incredible discoveries (My Very Important Encyclopedias),DK Children 0-9,2020-09-03,1,33,10.666666666666666,0,234,In Print,0.0,0.0,,3.0,12.0,36.0,Low
9780241538333,DK Life Stories: Martin Luther King Jr,DK Children 0-9,2022-01-06,1,8,4.0,0,1326,In Print,0.0,0.0,,2.0,8.0,24.0,Low
9780241726136,My First Busy Home: Let's Look and Learn! (My First Tabbed Board Book),DK Children 0-9,2025-02-06,1,2,,0,3937,In Print,0.0,0.0,,0.0,1.0,4.0,Low
9780241538357,DK Life Stories Anne Frank,DK Children 0-9,2022-01-06,1,9,4.5,0,340,In Print,0.0,0.0,,2.0,8.0,24.0,Low
9780241439593,First Emotions: I Feel Proud,DK Children 0-9,2020-05-21,1,2,2.0,0,506,In Print,0.0,0.0,,1.0,4.0,12.0,Low
9780241439609,First Emotions: I Feel Angry,DK Children 0-9,2020-05-21,1,5,5.0,0,89,In Print,0.0,0.0,,1.0,4.0,12.0,Low
9780241442272,The Secret Explorers and the Jurassic Rescue,DK Children 0-9,2020-10-01,1,13,7.0,0,491,In Print,0.0,0.0,,2.0,7.0,23.0,Low
9780241442289,The Secret Explorers and the Smoking Volcano,DK Children 0-9,2021-04-01,1,12,6.5,0,411,In Print,0.0,0.0,,2.0,8.0,24.0,Low
9780241675199,Mars: Explore the Mysteries of the Red Planet (Space Explorers),DK Children 0-9,2024-09-05,1,5,5.0,0,282,In Print,0.0,0.0,,1.0,4.0,16.0,Low
9780241538463,Shy and Mighty: Your Shyness is a Superpower (Take on the World),DK Children 0-9,2022-04-07,1,13,4.666666666666667,0,1024,In Print,0.0,0.0,,3.0,12.0,36.0,Low
9780241356319,DK Life Stories Florence Nightingale,DK Children 0-9,2019-04-04,1,11,5.0,0,156,In Print,0.0,0.0,,2.0,8.0,24.0,Low
9780241375587,100 First Dinosaur Words,DK Children 0-9,2019-10-03,1,8,4.0,0,617,In Print,0.0,0.0,,2.0,9.0,33.0,Low
9780241525791,Adventures with Finn and Skip: Forest,DK Children 0-9,2022-01-06,1,4,4.0,0,748,In Print,0.0,0.0,,1.0,4.0,12.0,Low
9780241467497,DK Life Stories Marie Curie,DK Children 0-9,2022-01-06,1,5,2.5,0,1038,In Print,0.0,0.0,,2.0,5.0,13.0,Low
9780241377918,DK Life Stories Nelson Mandela,DK Children 0-9,2019-07-04,1,1,,1,907,In Print,0.0,0.0,,0.0,0.0,0.0,Low
9780241512906,Amazing Animal Journeys: The Most Incredible Migrations in the Natural World (DK Amazing Earth),DK Children 0-9,2023-02-02,1,7,7.0,1,540,In Print,0.0,0.0,,1.0,4.0,12.0,Low
9780241358566,"How To Be a Coder: Learn to Think like a Coder with Fun Activities, then Code in Scratch 3.0 Online! (Careers for Kids)",DK Children 0-9,2019-07-04,1,9,9.0,0,370,In Print,0.0,0.0,,1.0,4.0,12.0,Low
9781409344827,"Maths Made Easy: Beginner, Ages 8-9 (Key Stage 2): Supports the National Curriculum, Maths Exercise Book (Made Easy Workbooks)",DK Children 0-9,2014-07-01,1,36,6.666666666666667,0,199,In Print,0.0,1000.0,2025-03-03,6.0,24.0,75.0,Low
9780241583937,Kindness Club Rabbit Says Sorry: Join the Kindness Club as They Find the Courage To Be Kind,DK Children 0-9,2023-05-04,1,0,,0,63,In Print,0.0,0.0,,,,,Low
9780241538685,Animal Ultimate Handbook: The Need-to-Know Facts and Stats on More Than 200 Animals (DK's Ultimate Handbooks),DK Children 0-9,2022-07-07,1,7,7.0,0,1414,In Print,0.0,0.0,,1.0,4.0,12.0,Low
9780241581858,The Maths Adventurers Measure Up: Discover Height and Length,DK Children 0-9,2023-06-01,1,6,,0,893,In Print,0.0,0.0,,0.0,0.0,0.0,Low
9780241284971,DKfindout! Forest,DK Children 0-9,2017-07-06,1,3,3.0,2,201,In Print,0.0,0.0,,1.0,4.0,12.0,Low
9780241502389,I Feel Scared: Why Do I Feel Scared Today? (First Emotions),DK Children 0-9,2021-09-16,1,4,4.0,0,137,In Print,0.0,0.0,,1.0,4.0,12.0,Low
9780241442791,DKfindout! Oceans,DK Children 0-9,2020-05-14,1,24,24.0,0,961,In Print,0.0,0.0,,1.0,4.0,12.0,Low
9780241559161,The Timekeepers: The Tesla Trap,DK Children 0-9,2024-07-04,1,7,,0,492,In Print,0.0,0.0,,0.0,0.0,0.0,Low
9780241625880,The Magic of Forests: A Fascinating Guide to Forests Around the World,DK Children 0-9,2023-08-03,1,1,1.0,0,198,In Print,0.0,0.0,,1.0,0.0,0.0,Low
9780241355435,RHS The Magic and Mystery of Trees (The Magic and Mystery of Nature),DK Children 0-9,2019-03-07,1,122,19.333333333333332,0,596,In Print,0.0,0.0,,6.0,31.0,110.0,Low
9780241533543,It's a Wonderful World: How to Protect the Planet and Change the Future,DK Children 0-9,2022-03-10,1,12,11.0,0,1173,In Print,0.0,0.0,,1.0,4.0,12.0,Low
9780241442258,The Secret Explorers and the Comet Collision,DK Children 0-9,2020-07-16,1,11,12.0,0,293,In Print,0.0,0.0,,1.0,4.0,12.0,Low
9780241459454,Amazing Earth: The Most Incredible Places From Around The World (DK Amazing Earth),DK Children 0-9,2021-08-05,1,12,12.0,0,966,In Print,0.0,0.0,,1.0,4.0,12.0,Low
9780241282526,Woodland and Forest: Explore Nature with Fun Facts and Activities (Nature Explorers),DK Children 0-9,2017-03-30,1,9,,0,147,In Print,0.0,0.0,,0.0,0.0,4.0,Low
9780241585061,Find My Favourite Things Farm: Search and Find! Follow the Characters From Page to Page! (DK Find My Favorite),DK Children 0-9,2023-04-06,1,0,0.0,0,0,Reprinting,0.0,500.0,2025-03-03,4.0,16.0,48.0,High
9780241630709,Make Art with Nature: Find Inspiration and Materials From Nature,DK Children 0-9,2024-03-07,1,46,11.0,0,464,In Print,0.0,0.0,,4.0,16.0,47.0,Low
9780241461426,"Get To Know: Money: A Fun, Visual Guide to How Money Works and How to Look After It",DK Children 0-9,2022-12-08,1,9,9.0,0,50,In Print,0.0,0.0,,1.0,4.0,12.0,Low
9780241537510,Little Chunkies: Animals in the Wild: With Adorable Animals to Touch and Discover,DK Children 0-9,2023-03-02,1,5,,0,741,In Print,0.0,0.0,,0.0,0.0,0.0,Low
9780241397282,100 First Things to Know,DK Children 0-9,2020-01-02,1,3,,0,122,In Print,0.0,0.0,,0.0,0.0,0.0,Low
9780241669105,Amazing Space: The Most Incredible Features of the Known Universe (DK Amazing Earth),DK Children 0-9,2024-08-01,1,35,18.5,0,773,In Print,0.0,940.0,2025-02-10,2.0,9.0,32.0,Low
9781409345961,My First Trucks and Diggers Let's Get Driving (My First Tabbed Board Book),DK Children 0-9,2014-01-16,1,0,0.0,0,0,Out of Print,0.0,0.0,,12.0,57.0,228.0,High
9780241664933,An Anthology of Intriguing Animals Poster Book: With More Than 30 Reversible Tear-Out Posters (DK Children's Anthologies),DK Children 0-9,2023-11-02,1,7,7.0,0,2263,In Print,0.0,0.0,,1.0,4.0,12.0,Low
9780241358580,DK Life Stories Katherine Johnson,DK Children 0-9,2019-01-03,1,5,,0,253,In Print,0.0,0.0,,0.0,0.0,0.0,Low
9780241467466,Eco Baby Where Are You Koala?: A Plastic-free Touch and Feel Book,DK Children 0-9,2021-02-04,1,5,5.0,0,329,In Print,0.0,0.0,,1.0,4.0,12.0,Low
9780241316702,How to Measure Everything: A Fun First Guide to the Maths of Measuring (My Really Fun Maths and Science Books),DK Children 0-9,2018-07-05,1,6,3.0,0,750,In Print,0.0,0.0,,2.0,8.0,24.0,Low
9780241702222,The Mysteries of the Universe Poster Book (DK Children's Anthologies),DK Children 0-9,2024-09-05,1,26,,0,507,In Print,0.0,0.0,,0.0,0.0,0.0,Low
9780241656549,My Encyclopedia of Very Important Dinosaurs: For Little Dinosaur Lovers Who Want to Know Everything (My Very Important Encyclopedias),DK Children 0-9,2024-07-04,1,7,3.5,1,799,In Print,0.0,0.0,,2.0,5.0,13.0,Low
9780241464168,First Emotions: My Little Box of Emotions: Little guides for all my emotions,DK Children 0-9,2020-10-01,1,5,5.0,0,0,Out of Print,0.0,0.0,,1.0,3.0,3.0,Low
9780241685464,How the Earth Works: Discover How Plate Tectonics Shapes Our Planet,DK Children 0-9,2025-03-06,1,0,0.0,0,3912,NOT YET PUBLISHED,23.0,3860.0,2025-02-06,3.0,72.0,306.0,Low
9780241301777,Baby's First Words (Baby's First Board Books),DK Children 0-9,2018-02-01,1,30,9.333333333333334,0,73,In Print,0.0,0.0,,3.0,12.0,37.0,Low
9780241647479,The Children's Book of the Future,DK Children 0-9,2024-06-13,1,145,38.5,0,2337,In Print,0.0,0.0,,4.0,13.0,43.0,Low
9780241676110,Elizabeth I: Queen of England 1558-1603 (History's Great Leaders),DK Children 0-9,2024-07-04,1,97,23.0,0,671,In Print,0.0,0.0,,4.0,16.0,47.0,Low
9780241282519,Weather: Explore Nature with Fun Facts and Activities (Nature Explorers),DK Children 0-9,2017-03-30,1,4,,0,160,In Print,0.0,0.0,,0.0,0.0,0.0,Low
9780241584989,I Love My Farm: A Pop-Up Book About Animals on the Farm,DK Children 0-9,2023-02-02,1,2,,0,1066,In Print,0.0,0.0,,0.0,0.0,0.0,Low
9780241188750,First Science Encyclopedia: A First Reference Book for Children (DK First Reference),DK Children 0-9,2017-06-01,1,27,9.666666666666666,0,918,In Print,0.0,0.0,,3.0,12.0,36.0,Low
9780241356074,Jonny Lambert's Animal ABC (Jonny Lambert Illustrated),DK Children 0-9,2018-09-06,1,13,4.666666666666667,0,1816,In Print,0.0,0.0,,3.0,12.0,36.0,Low
9780241481073,DKfindout! Rubbish,DK Children 0-9,2021-07-01,1,1,1.0,0,1186,In Print,0.0,0.0,,1.0,4.0,12.0,Low
9781409344865,"Maths Made Easy: Matching & Sorting, Ages 3-5 (Preschool): Supports the National Curriculum, Maths Exercise Book (Made Easy Workbooks)",DK Children 0-9,2014-07-01,1,11,5.0,0,1988,In Print,0.0,0.0,,2.0,8.0,24.0,Low
9781409334668,Pop-Up Peekaboo! Christmas,DK Children 0-9,2013-09-02,1,0,0.0,0,0,Reprint under Review,0.0,0.0,,1.0,4.0,8.0,High
9780241459478,Pop-Up Peekaboo! Dragon,DK Children 0-9,2021-10-28,1,17,8.0,0,5663,In Print,0.0,0.0,,2.0,8.0,24.0,Low
9780241533413,Dinosaur Club: A Triceratops Charge,DK Children 0-9,2022-02-03,1,26,13.0,0,97,In Print,0.0,0.0,,2.0,11.0,38.0,Low
9780241533475,Baby Dinosaur on the Farm: Follow Baby Dinosaur and his Search for Farmyard Fun!,DK Children 0-9,2022-03-03,1,1,,0,1036,In Print,0.0,0.0,,0.0,0.0,0.0,Low
9780241461389,The Really Incredible Science Book (My Really Fun Maths and Science Books),DK Children 0-9,2021-06-03,1,28,9.0,0,376,In Print,0.0,0.0,,3.0,12.0,36.0,Low
9780241563496,The Best Ever Cake Book: 20 Step-by-Step Cake Recipes from Around the World (DK's Best Ever Cook Books),DK Children 0-9,2022-09-01,1,9,5.0,1,1212,In Print,0.0,0.0,,2.0,8.0,24.0,Low
9780241668528,The Book of Bedtime Stories: Classic Tales for Children,DK Children 0-9,2024-06-13,1,14,,0,299,In Print,0.0,1500.0,2025-02-28,0.0,0.0,0.0,Low
9780241355657,Jonny Lambert's Animal 123 (Jonny Lambert Illustrated),DK Children 0-9,2018-09-06,1,11,6.0,0,647,In Print,0.0,0.0,,2.0,8.0,24.0,Low
9780241467503,"I Am, I Can: Affirmations Flash Cards for Kids: with Motivational Mantras and Creative Activities (Mindfulness for Kids)",DK Children 0-9,2021-02-04,1,8,8.0,0,183,In Print,0.0,0.0,,1.0,4.0,12.0,Low
9780241667736,Peter and the Wolf: Wolves Come in Many Disguises,DK Children 0-9,2023-10-19,1,5,5.0,0,8349,In Print,0.0,0.0,,1.0,3.0,9.0,Low
9781405300872,Tractor (WHEELIE BOOKS),DK Children 0-9,2003-06-05,1,6,6.0,0,1319,In Print,0.0,0.0,,1.0,3.0,11.0,Low
9780241412206,How to Make a Better World: For Every Kid Who Wants to Make a Difference (Take on the World),DK Children 0-9,2020-03-05,1,14,6.5,0,353,In Print,0.0,0.0,,2.0,8.0,24.0,Low
9780241664735,1000 More Words: Build More Vocabulary and Literacy Skills (Vocabulary Builders),DK Children 0-9,2024-06-06,1,9,,0,1714,In Print,0.0,0.0,,0.0,0.0,0.0,Low
9781409344728,"English Made Easy: The Alphabet, Ages 3-5 (Preschool): Supports the National Curriculum, English Exercise Book (Made Easy Workbooks)",DK Children 0-9,2014-07-01,1,22,12.0,0,1308,In Print,0.0,1000.0,2025-02-10,2.0,8.0,24.0,Low
9780241379257,How to Tell the Time: A Lift-the-flap Guide to Telling the Time (My Really Fun Maths and Science Books),DK Children 0-9,2019-07-04,1,8,8.0,0,262,In Print,0.0,0.0,,1.0,4.0,12.0,Low
9780241319536,1000 Useful Words: Build Vocabulary and Literacy Skills (Vocabulary Builders),DK Children 0-9,2018-09-06,1,41,12.666666666666666,0,4067,In Print,0.0,0.0,,3.0,12.0,36.0,Low
9780241411636,Does a Dinosaur Roar? (Why? Series),DK Children 0-9,2020-03-05,1,1,,0,870,In Print,0.0,0.0,,0.0,0.0,0.0,Low
9780241596166,Baby Touch and Feel Bunny,DK Children 0-9,2023-03-02,1,15,15.0,0,1303,In Print,0.0,0.0,,1.0,8.0,36.0,Low
9780241413906,A World Full of Poems: Inspiring poetry for children,DK Children 0-9,2020-10-01,1,9,9.0,1,427,In Print,0.0,0.0,,1.0,4.0,13.0,Low
9780241414750,Calm - Mindfulness Flash Cards for Kids: 40 Activities to Help you Learn to Live in the Moment (Mindfulness for Kids),DK Children 0-9,2019-10-03,1,8,8.0,0,566,In Print,0.0,0.0,,1.0,4.0,12.0,Low
9780241599563,What Do We Know About History?: With 200 Amazing Questions About the Past (Why? Series),DK Children 0-9,2023-08-03,1,11,12.0,0,423,In Print,0.0,0.0,,1.0,4.0,12.0,Low
9780241501078,"The Best Ever Bread Book: From Farm to Flour Mill, Recipes from Around the World (DK's Best Ever Cook Books)",DK Children 0-9,2021-10-07,1,45,13.666666666666666,0,713,In Print,0.0,0.0,,3.0,12.0,36.0,Low
9780241185476,My First Animals,DK Children 0-9,2015-02-02,1,21,7.333333333333333,0,233,In Print,0.0,1000.0,2025-04-14,3.0,12.0,36.0,Low
9780751367805,The Ultimate Ocean Creatures Glow in the Dark Sticker Book (Ultimate Stickers),DK Children 0-9,2003-07-03,1,0,,0,0,Out of Print,0.0,0.0,,,,,Low
9780241519622,Dinosaur Ultimate Handbook: The Need-To-Know Facts and Stats on Over 150 Different Species (DK's Ultimate Handbooks),DK Children 0-9,2021-10-28,1,10,11.0,0,1454,In Print,0.0,0.0,,1.0,4.0,12.0,Low
9780241439579,First Emotions: I Feel Happy,DK Children 0-9,2020-05-21,1,6,6.0,0,305,In Print,0.0,0.0,,1.0,4.0,12.0,Low
9780241285060,DKfindout! Coding,DK Children 0-9,2017-07-06,1,6,6.0,0,397,In Print,0.0,0.0,,1.0,4.0,12.0,Low
9780241467565,Life Skills (Take on the World),DK Children 0-9,2021-04-01,1,11,11.0,0,159,In Print,0.0,0.0,,1.0,4.0,13.0,Low
9780241538654,The Timekeepers: First Flight,DK Children 0-9,2023-09-07,1,9,10.0,0,766,In Print,0.0,0.0,,1.0,4.0,12.0,Low
9780241615379,Ask A Scientist (New Edition): Professor Robert Winston Answers More Than 100 Big Questions From Kids Around the World!,DK Children 0-9,2023-04-06,1,24,11.5,0,773,In Print,0.0,0.0,,2.0,8.0,24.0,Low
9780241459508,"What's The Weather?: Clouds, Climate, and Global Warming (Protect the Planet)",DK Children 0-9,2021-01-07,1,31,10.333333333333334,0,412,In Print,0.0,0.0,,3.0,12.0,36.0,Low
9780241538401,The Fact-Packed Activity Book: Human Body,DK Children 0-9,2022-04-07,1,9,9.0,0,1488,In Print,0.0,0.0,,1.0,4.0,12.0,Low
9780241525920,My Very Important Earth Encyclopedia: For Little Learners Who Want to Know About Our Planet (My Very Important Encyclopedias),DK Children 0-9,2022-09-01,1,35,9.0,0,1176,In Print,0.0,0.0,,4.0,16.0,48.0,Low
9780241559208,Dinosaur Club: Avoiding the Allosaurus,DK Children 0-9,2023-09-07,1,25,5.2,0,354,In Print,0.0,0.0,,5.0,20.0,66.0,Low
9780241544280,Casper and Daisy's Big Day at the Park (Adventures with Casper and Daisy),DK Children 0-9,2021-07-08,1,27,28.0,0,313,In Print,0.0,0.0,,1.0,4.0,12.0,Low
9780241634400,Jonny Lambert’s Bear and Bird: Find a Footprint: A Woodland Search and Find Adventure (The Bear and the Bird),DK Children 0-9,2023-09-07,1,4,,0,226,In Print,0.0,0.0,,0.0,0.0,0.0,Low
9780241657430,Dinosaur Club: March of the Ankylosaurus,DK Children 0-9,2024-07-04,1,36,11.333333333333334,0,600,In Print,0.0,0.0,,3.0,12.0,42.0,Low
9780241655405,"Jonny Lambert’s Bear and Bird: Try, Try Again (The Bear and the Bird)",DK Children 0-9,2024-09-05,1,4,,0,888,In Print,0.0,0.0,,0.0,0.0,0.0,Low
9780241538388,Radzi's Incredible Facts: Mind-Blowing Facts to Make You the Smartest Kid Around!,DK Children 0-9,2023-09-07,1,40,,0,1044,In Print,0.0,0.0,,0.0,0.0,0.0,Low
9780241525913,Animal Teams: How Amazing Animals Work Together in the Wild,DK Children 0-9,2022-02-03,1,0,,0,9,In Print,0.0,0.0,,0.0,0.0,0.0,Low
9780241609026,My First Colours: Let's Learn Them All! (My First Board Books),DK Children 0-9,2023-09-07,1,38,10.25,0,2831,In Print,0.0,0.0,,4.0,20.0,61.0,Low
9780241533390,Be Climate Clever (Be Environmentally Clever),DK Children 0-9,2022-04-07,1,5,,0,2301,In Print,0.0,0.0,,0.0,0.0,0.0,Low
9780241679623,A First Book of Fairy Tales,DK Children 0-9,2024-09-05,1,32,10.666666666666666,0,1885,In Print,0.0,1476.0,2025-02-10,3.0,12.0,36.0,Low
9780241528068,Galapagos: A Unique World of Natural Wonders,DK Children 0-9,2022-10-06,1,35,11.333333333333334,0,4729,In Print,0.0,0.0,,3.0,12.0,36.0,Low
9780241225202,DKfindout! Solar System,DK Children 0-9,2016-07-01,1,22,7.0,0,734,In Print,0.0,0.0,,3.0,12.0,36.0,Low
9780241282731,DKfindout! Sharks,DK Children 0-9,2017-01-16,1,17,9.0,0,168,In Print,0.0,500.0,2025-03-03,2.0,4.0,12.0,Low
9780241538708,Dinosaur Club: Tracking the Diplodocus,DK Children 0-9,2022-08-04,1,17,9.0,0,828,In Print,0.0,0.0,,2.0,13.0,45.0,Low
9780241680810,Pocket Pop-Up Peekaboo! Baby Dinosaur,DK Children 0-9,2024-02-01,1,9,9.0,0,2199,In Print,0.0,0.0,,1.0,3.0,10.0,Low
9781405367295,Baby Touch and Feel Cuddly Animals,DK Children 0-9,2011-09-01,1,7,7.0,0,1770,In Print,0.0,0.0,,1.0,4.0,12.0,Low
9780241484326,Look I'm An Ecologist (Look! I'm Learning),DK Children 0-9,2021-09-16,1,2,,0,881,In Print,0.0,0.0,,0.0,0.0,0.0,Low
9780241300374,Cooking Step By Step: More than 50 Delicious Recipes for Young Cooks,DK Children 0-9,2018-02-01,1,12,0.36666666666666664,0,0,Out of Print,0.0,0.0,,30.0,202.0,752.0,High
9781405329125,Baby Touch and Feel Farm,DK Children 0-9,2008-02-01,1,52,49.0,0,1969,In Print,0.0,0.0,,1.0,4.0,14.0,Low
9780241585597,"The Egg Book: See How Baby Animals Hatch, Step By Step!",DK Children 0-9,2023-02-02,1,41,22.0,0,904,In Print,0.0,0.0,,2.0,8.0,24.0,Low
9780241196069,High-Intensity Interval Training for Women: Burn More Fat in Less Time with HIIT Workouts You Can Do Anywhere,DK Alpha,2015-05-01,1,9,5.0,0,0,Reprint under Review,0.0,0.0,,2.0,8.0,24.0,Low
9780744094824,Zero Sugar / One Month: Reduce Cravings - Reset Metabolism - Lose Weight - Lower Blood Sugar,DK Alpha,2024-01-02,1,35,11.0,0,2734,In Print,0.0,0.0,,3.0,9.0,25.0,Low
9780744070590,"The T Guide: Our Trans Experiences and a Celebration of Gender Expression―Man, Woman, Nonbinary, and Beyond",DK Alpha,2023-05-16,1,0,0.0,0,1781,In Print,0.0,0.0,,1.0,4.0,12.0,Low
9780744092479,"Budgeting for Beginners: 10 (Pocket Guides, 10)",DK Alpha,2024-02-13,1,0,,0,1120,In Print,0.0,0.0,,0.0,0.0,0.0,Low
9780744090932,The Tried & True Cookbook: 150 Quick and Easy Recipes for Busy Families,DK Alpha,2024-03-26,1,4,,0,1538,In Print,0.0,0.0,,0.0,0.0,0.0,Low
9780744083880,"Cooking con Claudia: 100 Authentic, Family-Style Mexican Recipes",DK Alpha,2023-10-24,1,0,,0,0,No Longer Distributed,0.0,0.0,,0.0,0.0,0.0,Low
9780744094572,Coastal Harvest: Fish - Forage - Feast: A Cookbook,DK Alpha,2025-03-25,1,0,0.0,0,1371,NOT YET PUBLISHED,27.0,1460.0,2025-01-23,1.0,8.0,357.0,Low
9780241680193,Edinburgh Like a Local: By the People Who Call It Home (Local Travel Guide),DK Travel,2024-06-06,0,22,11.5,0,986,In Print,0.0,0.0,,2.0,8.0,24.0,Low
9780241007969,Top 10 Puerto Rico: DK Eyewitness Top 10 Travel Guide 2015 (Pocket Travel Guide),DK Travel,2015-09-01,0,12,12.0,0,165,In Print,0.0,0.0,,1.0,4.0,12.0,Low
9780241612897,DK Europe (Travel Guide),DK Travel,2023-04-06,0,14,4.666666666666667,0,1704,In Print,0.0,0.0,,3.0,12.0,32.0,Low
9780241612989,DK Top 10 European Cities (Pocket Travel Guide),DK Travel,2023-04-06,0,10,10.0,0,592,In Print,0.0,0.0,,1.0,4.0,12.0,Low
9781409370055,DK Eyewitness Travel Guide Moscow: DK Eyewitness Travel Guide 2015,DK Travel,2015-04-01,0,1,,0,121,In Print,0.0,0.0,,0.0,0.0,0.0,Low
9780241306567,"DK Eyewitness Family Guide Washington, DC (Travel Guide)",DK Travel,2018-04-05,0,6,,0,400,In Print,0.0,0.0,,0.0,0.0,0.0,Low
9780241568842,DK Cuba (Travel Guide),DK Travel,2022-09-22,0,28,9.666666666666666,0,0,Out of Print,0.0,0.0,,3.0,8.0,26.0,Low
9781405333726,"DK Eyewitness Top 10 Travel Guide: Berlin: (E/W, 2009)",DK Travel,2009-02-02,0,0,,0,0,Out of Print,0.0,0.0,,,,,Low
9780241568989,DK Eyewitness Caribbean (Travel Guide),DK Travel,2024-12-05,0,0,0.0,0,0,Publication Cancelled,0.0,0.0,,1.0,6.0,28.0,High
9781409328476,DK Eyewitness Travel Guide: Austria: Eyewitness Travel Guide 2014,DK Travel,2014-02-03,0,0,,0,0,Out of Print,0.0,0.0,,,,,Low
9780241364659,DK Eyewitness Top 10 Corsica (Pocket Travel Guide),DK Travel,2019-05-02,0,1,,0,0,Out of Print,0.0,0.0,,0.0,0.0,0.0,Low
9780241368749,DK London: 2020 (Travel Guide),DK Travel,2019-09-05,0,0,,0,0,Out of Print,0.0,0.0,,0.0,0.0,0.0,Low
9781405360654,DK Eyewitness Travel Guide: Belgium & Luxembourg: Eyewitness Travel Guide 2011,DK Travel,2011-06-01,0,0,,0,0,Out of Print,0.0,0.0,,0.0,0.0,0.0,Low
9780241275399,"DK Eyewitness Travel Guide Brussels, Bruges, Ghent and Antwerp: Bruges, Ghent & Antwerp",DK Travel,2017-07-06,0,2,0.4,0,0,Out of Print,0.0,0.0,,5.0,22.0,70.0,High
9780241296318,Top 10 Italian Lakes (Pocket Travel Guide),DK Travel,2018-03-01,0,0,,0,0,Out of Print,0.0,0.0,,0.0,0.0,0.0,Low
9780241007938,Top 10 Singapore: DK Eyewitness Top 10 Travel Guide 2015 (DK Eyewitness Travel Guide),DK Travel,2015-08-03,0,0,,0,0,Out of Print,0.0,0.0,,0.0,0.0,0.0,Low
9780241462768,"DK Eyewitness Amsterdam: inspire, plan, discover, experience (Travel Guide)",DK Travel,2021-05-13,0,1,,0,0,Out of Print,0.0,0.0,,0.0,0.0,0.0,Low
9781405353151,DK Eyewitness Travel Guide: Switzerland: Eyewitness Travel Guide 2010,DK Travel,2010-06-01,0,0,,0,0,Out of Print,0.0,0.0,,0.0,0.0,0.0,Low
9780241719633,DK Provence and the Côte d'Azur (Travel Guide),DK Travel,2025-04-17,0,0,,0,0,NOT YET PUBLISHED,6.0,3500.0,2025-02-19,0.0,5.0,283.0,High
9781409373520,DK Eyewitness Top 10 Travel Guide: Malta & Gozo,DK Travel,2013-07-01,0,0,,0,0,Out of Print,0.0,0.0,,0.0,0.0,0.0,Low
9780241208090,Back Roads Spain: Eyewitness Travel 2016 (Travel Guide),DK Travel,2016-04-01,0,0,,0,0,Out of Print,0.0,0.0,,0.0,0.0,0.0,Low
9780241310564,DK Eyewitness Top 10 Madeira (Pocket Travel Guide),DK Travel,2018-07-05,0,0,0.0,0,0,Out of Print,0.0,0.0,,3.0,11.0,51.0,High
9780241568293,DK USA (Travel Guide),DK Travel,2022-07-21,0,2,2.0,0,0,Out of Print,0.0,0.0,,1.0,4.0,12.0,High
9780241544310,DK Eyewitness Vietnam (Travel Guide),DK Travel,2021-11-11,0,0,0.0,0,0,Out of Print,0.0,0.0,,1.0,4.0,12.0,High
9780241568507,Florence Like a Local: By the People Who Call It Home (Local Travel Guide),DK Travel,2022-10-06,0,8,8.0,0,249,In Print,0.0,0.0,,1.0,4.0,12.0,Low
9780241278710,Top 10 New Orleans (Pocket Travel Guide),DK Travel,2017-10-05,0,0,,0,0,Out of Print,0.0,0.0,,0.0,0.0,0.0,Low
9780241686799,Austin Like a Local: By the People Who Call It Home (Local Travel Guide),DK Travel,2024-07-04,0,7,7.0,0,668,In Print,0.0,0.0,,1.0,4.0,12.0,Low
9780241621271,DK Top 10 Venice (Pocket Travel Guide),DK Travel,2023-09-07,0,4,2.0,0,0,Out of Print,0.0,0.0,,2.0,14.0,56.0,High
9780241358283,DK Eyewitness Vietnam: Inspire / Plan / Discover / Experience (Travel Guide),DK Travel,2019-01-03,0,0,0.0,0,0,Out of Print,0.0,0.0,,3.0,7.0,17.0,High
9780241367995,DK Eyewitness Top 10 New Orleans (Pocket Travel Guide),DK Travel,2019-11-07,0,0,,0,0,Out of Print,0.0,0.0,,0.0,0.0,0.0,Low
9780241721773,"DK Pacific Northwest: Oregon, Washington and British Columbia (Travel Guide)",DK Travel,2025-05-01,0,0,,0,0,NOT YET PUBLISHED,2.0,1500.0,2025-04-04,0.0,2.0,46.0,High
9781409328469,DK Eyewitness Travel Guide: Venice & the Veneto: Eyewitness Travel Guide 2014,DK Travel,2014-02-03,0,0,,0,0,Out of Print,0.0,0.0,,0.0,0.0,0.0,Low
9780241538753,DK Vienna (Travel Guide),DK Travel,2022-09-22,0,7,3.5,0,0,Out of Print,0.0,0.0,,2.0,8.0,24.0,High
9780241407707,DK Eyewitness Venice and the Veneto (Travel Guide),DK Travel,2020-01-02,0,0,,0,0,Out of Print,0.0,0.0,,0.0,0.0,0.0,Low
9780241306109,DK Eyewitness Travel Guide Austria,DK Travel,2018-03-01,0,0,,0,0,Out of Print,0.0,0.0,,0.0,0.0,0.0,Low
9781405369916,DK Eyewitness Top 10 Travel Guide: Dubrovnik & the Dalmatian Coast,DK Travel,2012-06-01,0,0,,0,0,Out of Print,0.0,0.0,,0.0,0.0,0.0,Low
9780241367940,DK Eyewitness Top 10 Cancún and the Yucatán (Pocket Travel Guide),DK Travel,2019-10-03,0,1,,0,0,Out of Print,0.0,0.0,,0.0,0.0,0.0,Low
9781409386513,DK Eyewitness Travel Guide: Vietnam and Angkor Wat: Eyewitness Travel Guide 2013,DK Travel,2013-08-01,0,0,,0,0,Out of Print,0.0,0.0,,,,,Low
9780241358313,DK Lisbon (Travel Guide),DK Travel,2019-01-03,0,0,,0,0,Out of Print,0.0,0.0,,0.0,0.0,0.0,Low
9780241259658,Top 10 Dubrovnik and the Dalmatian Coast: Eyewitness Travel Guide 2017 (DK Eyewitness Travel Guide),DK Travel,2017-03-30,0,0,,0,0,Out of Print,0.0,0.0,,0.0,0.0,0.0,Low
9780241208281,DK Eyewitness Travel Guide Portugal: Eyewitness Travel Guide 2016,DK Travel,2016-04-01,0,0,,0,0,Out of Print,0.0,0.0,,0.0,0.0,0.0,Low
9781405333818,DK Eyewitness Top 10 Travel Guide: Rome,DK Travel,2009-03-02,0,0,,0,0,Out of Print,0.0,0.0,,,,,Low
9780241364697,DK Eyewitness Top 10 Budapest (Pocket Travel Guide),DK Travel,2019-06-06,0,0,0.0,0,0,Out of Print,0.0,0.0,,3.0,12.0,42.0,High
9781409371595,DK Eyewitness Travel Guide Loire Valley: DK Eyewitness Travel Guide 2015,DK Travel,2015-07-01,0,0,,0,0,Out of Print,0.0,0.0,,0.0,0.0,0.0,Low
9780241410424,DK Eyewitness Top 10 Stockholm (Pocket Travel Guide),DK Travel,2020-05-07,0,4,,0,0,Out of Print,0.0,0.0,,0.0,0.0,0.0,Low
