9781728273143,Slide and Smile: We Bee-long Together!,DK Other,2023-07-23,0,1,,0,0,No Longer Distributed,0.0,0.0,,0.0,0.0,0.0,Low
9781775293934,"The Deal: 1 (Off-Campus, 1)",DK Other,2015-02-24,0,18,18.0,0,0,Out of Print,0.0,0.0,,1.0,3.0,11.0,Low
9781641524131,"The Essential Vegan Air Fryer Cookbook: 75 Whole Food Recipes to Fry, Bake, and Roast",DK Other,2019-07-18,0,0,0.0,0,0,Reprint under Review,0.0,0.0,,1.0,5.0,20.0,High
9781728256528,The Holiday Mix-Up,DK Other,2023-11-10,0,3,,0,374,In Print,0.0,0.0,,0.0,0.0,0.0,Low
9781728221465,Isabella: Girl in Charge,DK Other,2020-09-01,0,0,,0,0,No Longer Distributed,0.0,0.0,,,,,Low
9781638788317,My First Book of Planets: All About the Solar System for Kids,DK Other,2021-11-19,0,0,0.0,0,0,No Longer Distributed,0.0,0.0,,11.0,49.0,191.0,High
9781775293958,"The Score: 3 (Off-Campus, 3)",DK Other,2016-01-11,0,0,,0,0,Out of Print,0.0,0.0,,0.0,0.0,0.0,Low
9781728219707,I Feel... Different,DK Other,2020-11-06,0,0,,0,0,No Longer Distributed,0.0,0.0,,0.0,0.0,0.0,Low
9781728269931,Clock Struck Murder: 2 (Lost in Paris),DK Other,2024-05-09,0,1,,0,225,In Print,0.0,0.0,,0.0,0.0,0.0,Low
9781728214948,Finders Keepers: 3 (The Millionaires Club),DK Other,2024-05-30,0,3,,0,194,In Print,0.0,0.0,,0.0,0.0,0.0,Low
9781728268422,The Fallout: 2 (The Warning),DK Other,2023-10-05,0,1,,0,100,In Print,0.0,0.0,,0.0,0.0,0.0,Low
9781464236068,Christmas Eve Love Story: A Time Travel Holiday Romance Full of Christmas Magic,DK Other,2024-10-08,0,12,,0,870,In Print,0.0,0.0,,0.0,0.0,0.0,Low
9781728294773,A Crown of Ivy and Glass,DK Other,2023-05-09,0,14,15.0,0,1296,In Print,0.0,0.0,,1.0,4.0,17.0,Low
9781728284576,Hanukkah Pajamakkahs,DK Other,2024-10-03,0,16,,0,58,In Print,0.0,0.0,,0.0,0.0,0.0,Low
9781728267814,"Katie, Big and Strong: The True Story of the Mighty Woman Who Could Lift Anything",DK Other,2024-11-01,0,25,,0,147,In Print,0.0,0.0,,0.0,0.0,0.0,Low
9781728231990,A Crown of Ivy and Glass: 1 (The Middlemist Trilogy),DK Other,2023-06-27,0,0,,0,0,No Longer Distributed,0.0,0.0,,0.0,0.0,0.0,Low
9781492672722,The World's End: 3 (A Hundred Names for Magic),DK Other,2024-01-05,0,2,,0,0,No Longer Distributed,0.0,0.0,,0.0,0.0,0.0,Low
9781728291383,Future Lab: Tomorrow's School: 3,DK Other,2024-07-03,0,8,,0,88,In Print,0.0,0.0,,0.0,0.0,0.0,Low
9781728217109,Home Is Where Your Bark Is,DK Other,2024-12-19,0,0,,0,0,No Longer Distributed,0.0,0.0,,0.0,0.0,0.0,Low
9780525431886,"Fifty Shades Darker (Movie Tie-in Edition): Book Two of the Fifty Shades Trilogy: 2 (Fifty Shades Of Grey Series, 2)",DK Other,2017-02-03,0,0,,0,0,No Longer Distributed,0.0,0.0,,0.0,0.0,0.0,Low
9781464242250,The Rules of Dating: A Fiery Forbidden Single Dad Romance (The Law of Opposites Attract),DK Other,2025-04-08,0,0,,0,0,NOT YET PUBLISHED,1.0,0.0,,0.0,0.0,15.0,Low
9781728278056,Curves for Days: 1 (Big Love from Galway),DK Other,2023-10-12,0,3,,0,0,No Longer Distributed,0.0,0.0,,0.0,0.0,0.0,Low
9781492656685,"Lightbringer: 3 (The Empirium Trilogy, 3)",DK Other,2020-11-13,0,0,0.0,0,0,No Longer Distributed,0.0,0.0,,1.0,4.0,12.0,High
9781646321018,Letting Go of Perfect: Empower Children to Overcome Perfectionism,DK Other,2021-07-01,0,0,,0,0,Out of Print,0.0,0.0,,0.0,0.0,0.0,Low
9781728268958,"2024 Everyday Calm Planner: A Self-Care Organizer & Anxiety Log to Reset, Refresh, and Live Better",DK Other,2023-09-07,0,2,,0,0,No Longer Distributed,0.0,0.0,,0.0,0.0,0.0,Low
9781728278247,The Jolliest Bunch: Unhinged Holiday Stories,DK Other,2024-11-08,0,12,,0,91,In Print,0.0,0.0,,0.0,0.0,0.0,Low
9781464218620,This Girl's a Killer: A Novel,DK Other,2024-10-10,0,0,,0,0,No Longer Distributed,0.0,0.0,,0.0,0.0,0.0,Low
9781728281858,Adrift,DK Other,2023-05-09,0,1,,0,0,No Longer Distributed,0.0,0.0,,0.0,0.0,0.0,Low
9781728242491,Me and the Family Tree,DK Other,2023-06-01,0,0,,0,0,No Longer Distributed,0.0,0.0,,0.0,0.0,0.0,Low
9781728211251,My First 100 Technology Words (My First STEAM Words),DK Other,2020-05-07,0,6,,0,57,In Print,0.0,0.0,,0.0,0.0,0.0,Low
9781464216565,The Alphabutt Book: An ABCs of Baby Butts and Bodies,DK Other,2023-12-08,0,1,,0,0,No Longer Distributed,0.0,0.0,,0.0,0.0,0.0,Low
9781728292281,A Kid's Guide to the Night Sky: Simple Ways to Explore the Universe,DK Other,2024-11-01,0,0,,0,0,No Longer Distributed,0.0,0.0,,0.0,0.0,0.0,Low
9781728291291,"Pop Out Horses: Read, Build, and Play with These Fantastic Horses and Ponies: 5 (Pop Out Books)",DK Other,2024-05-02,0,3,,0,319,In Print,0.0,0.0,,0.0,0.0,0.0,Low
9781464237904,Axolotl and Axolittle,DK Other,2025-08-08,0,0,,0,0,NOT YET PUBLISHED,1.0,0.0,,0.0,0.0,0.0,Low
9781584691273,Going Home: The Mystery of Animal Migration (Sharing Nature with Children Books),DK Other,2010-04-01,0,0,,0,0,No Longer Distributed,0.0,0.0,,0.0,0.0,0.0,Low
9781492679226,Belle Révolte,DK Other,2020-03-04,0,2,,0,61,In Print,0.0,0.0,,0.0,0.0,0.0,Low
9781623159443,"The Healthy Meal Prep Cookbook: Easy and Wholesome Meals to Cook, Prep, Grab, and Go",DK Other,2017-09-22,0,1,0.25,0,0,Reprinting,0.0,0.0,,4.0,23.0,79.0,High
9781728292168,2025 Amy Knapp's Big Grid Family Organizer Wall Calendar: August 2024 - December 2025 (Amy Knapp's Plan Your Life Calendars),DK Other,2024-08-01,0,0,0.0,0,0,No Longer Distributed,0.0,0.0,,2.0,8.0,19.0,High
9781492672692,An Unreliable Magic: 2 (A Hundred Names for Magic),DK Other,2022-07-07,0,11,,0,0,No Longer Distributed,0.0,0.0,,0.0,0.0,0.0,Low
9781647397296,"Self-Love Workbook for Women: Release Self-Doubt, Build Self-Compassion, and Embrace Who You Are (Self-Love Workbook and Journal)",DK Other,2020-10-29,0,1,0.05263157894736842,0,0,Reprint under Review,0.0,0.0,,19.0,83.0,308.0,High
9781728268330,There's Snow One Like You (Punderland),DK Other,2023-11-17,0,1,,0,104,In Print,0.0,0.0,,,,,Low
9781728205670,"True Wolf: 3 (STAT, 3)",DK Other,2022-04-14,0,1,,0,0,No Longer Distributed,0.0,0.0,,0.0,0.0,0.0,Low
9781728221038,C'est La F-cking Vie 2021 Planner,DK Other,2020-06-12,0,0,,0,0,Out of Print,0.0,0.0,,0.0,0.0,0.0,Low
9781728249896,2023 Choose Happy Planner: August 2022-December 2023 (Inspire Instant Happiness Calendars & Gifts),DK Other,2022-06-01,0,0,,0,0,No Longer Distributed,0.0,0.0,,0.0,0.0,0.0,Low
9781728265568,You Won't Believe Me,DK Other,2023-07-27,0,3,,0,0,No Longer Distributed,0.0,0.0,,0.0,0.0,0.0,Low
9781728252049,The Secret on Set,DK Other,2023-01-19,0,3,,0,115,In Print,0.0,0.0,,0.0,0.0,0.0,Low
9781464230196,'Twas the Night Before Christmas,DK Other,2024-09-01,0,11,,0,1462,In Print,0.0,0.0,,0.0,0.0,0.0,Low
9781641521666,"Celebrate Your Body (and Its Changes, Too!): The Ultimate Puberty Book for Girls: 1",DK Other,2018-06-29,0,0,0.0,0,0,Reprinting,0.0,0.0,,10.0,42.0,137.0,High
9781728289595,"Little Orange Pumpkin (Little Heroes, Big Hearts)",DK Other,2024-09-06,0,9,,0,81,In Print,0.0,0.0,,0.0,0.0,0.0,Low
9781728299709,We Were Warned: The Propulsive Young Adult Thriller for Fans of Chilling Murder Mystery Books,DK Other,2025-04-04,0,0,0.0,0,2174,NOT YET PUBLISHED,2.0,0.0,,1.0,5.0,134.0,Low
9781647396732,The Complete Juicing Recipe Book: 360 Easy Recipes for a Healthier Life,DK Other,2020-10-22,0,0,0.0,0,0,Reprinting,0.0,0.0,,11.0,42.0,149.0,High
9781728275352,The Chase,DK Other,2022-07-28,0,1,,0,0,Out of Print,0.0,0.0,,0.0,0.0,0.0,Low
9781728248608,Buried in a Good Book: 1 (By the Book Mysteries),DK Other,2022-07-28,0,0,,0,0,No Longer Distributed,0.0,0.0,,0.0,0.0,0.0,Low
9781492693314,Wished,DK Other,2020-03-04,0,1,,0,6,In Print,0.0,0.0,,0.0,0.0,0.0,Low
9781728281827,The Gay Best Friend,DK Other,2023-06-06,0,8,8.0,0,99,In Print,0.0,0.0,,1.0,1.0,9.0,Low
9781728256009,When Franny Stands Up,DK Other,2022-12-22,0,1,,0,0,No Longer Distributed,0.0,0.0,,0.0,0.0,0.0,Low
9781464243172,The Last Great Heir: A Coming of Age Fantasy Adventure for Young Readers,DK Other,2025-01-28,0,12,3.25,0,2490,In Print,0.0,0.0,,4.0,14.0,39.0,Low
9781953424471,Dear Rebel: 145 Women Share Their Best Advice for the Girls of Today,DK Other,2023-10-03,0,74,75.0,0,647,In Print,0.0,0.0,,1.0,1.0,1.0,Low
9781728265117,The Woman with a Purple Heart: A Novel,DK Other,2023-12-07,0,1,,0,94,In Print,0.0,0.0,,0.0,0.0,0.0,Low
9781733176187,Ada Lovelace Cracks the Code,DK Other,2019-11-12,0,44,,0,515,In Print,0.0,0.0,,0.0,0.0,0.0,Low
9781728250588,"Never Been Kissed: 1 (Boy Meets Boy, 3)",DK Other,2022-06-03,0,15,14.0,0,125,In Print,0.0,0.0,,1.0,4.0,11.0,Low
9781728292557,Where Should We Camp Next?: Budget Camping; A 50-State Guide to Budget-Friendly Campgrounds and Free and Low-Cost Outdoor Activities,DK Other,2024-05-02,0,5,,0,31,In Print,0.0,0.0,,0.0,0.0,0.0,Low
9781728260044,So Much Snow,DK Other,2022-12-08,0,0,,1,93,In Print,0.0,0.0,,0.0,0.0,0.0,Low
9781728243146,The Next Ship Home: A Novel of Ellis Island,DK Other,2022-03-08,0,7,,0,0,No Longer Distributed,0.0,0.0,,0.0,0.0,0.0,Low
9781728265902,Blue Baboon Finds Her Tune,DK Other,2022-09-06,0,6,,0,213,In Print,0.0,0.0,,0.0,0.0,1.0,Low
9781464215759,The Nurse Murders: A Gene Hammons Novel: 2 (Phoenix Noir),DK Other,2024-01-05,0,1,,0,0,No Longer Distributed,0.0,0.0,,0.0,0.0,0.0,Low
9781728231792,"Wicked Beauty: A Divinely Dark Romance Retelling of Achilles, Patroclus and Helen of Troy (Dark Olympus 3)",DK Other,2022-06-07,0,13,13.0,0,0,No Longer Distributed,0.0,0.0,,1.0,4.0,5.0,Low
9781728276823,Big Witch Energy: 2 (Starfall Point),DK Other,2024-09-19,0,13,,0,64,In Print,0.0,0.0,,0.0,0.0,0.0,Low
9781728256276,The Holiday Trap,DK Other,2022-09-06,0,19,,0,108,In Print,0.0,0.0,,0.0,0.0,0.0,Low
9781570718427,101 Myths of the Bible: How Ancient Scribes Invented Biblical History,DK Other,2002-10-01,0,0,,0,0,No Longer Distributed,0.0,0.0,,0.0,0.0,0.0,Low
9781728282015,"American Prince: A Steamy and Taboo BookTok Sensation: 2 (New Camelot, 2)",DK Other,2023-02-01,0,21,22.0,0,1474,In Print,0.0,0.0,,1.0,4.0,12.0,Low
9781402253546,The Killer Book of Cold Cases,DK Other,2012-03-01,0,0,,0,0,No Longer Distributed,0.0,0.0,,0.0,0.0,0.0,Low
9781728223063,What Does It Mean to Be Present?,DK Other,2020-06-01,0,0,,0,0,No Longer Distributed,0.0,0.0,,0.0,0.0,0.0,Low
9781492682691,Be Dazzled,DK Other,2021-02-05,0,0,,0,0,No Longer Distributed,0.0,0.0,,0.0,0.0,0.0,Low
9781492650683,"Wayward Witch: 3 (Brooklyn Brujas, 3)",DK Other,2020-10-01,0,0,,0,0,No Longer Distributed,0.0,0.0,,0.0,0.0,0.0,Low
9781584690115,Girls Who Looked Under Rocks: The Lives of Six Pioneering Naturalists,DK Other,2011-02-01,0,0,,0,0,No Longer Distributed,0.0,0.0,,0.0,0.0,0.0,Low
9781733329262,Ada Lovelace Cracks the Code,DK Other,2023-02-07,0,1,,0,0,No Longer Distributed,0.0,0.0,,0.0,0.0,0.0,Low
9781492667377,Prelude for Lost Souls,DK Other,2020-09-04,0,16,,0,0,No Longer Distributed,0.0,0.0,,0.0,0.0,0.0,Low
9781728292526,"Life Lessons from a Parasite: What Tapeworms, Flukes, Lice, and Roundworms Can Teach Us About Humanity's Most Difficult Problems",DK Other,2024-09-20,0,20,,0,198,In Print,0.0,0.0,,0.0,0.0,0.0,Low
9781648762598,Fun to Find!: Search the Page,DK Other,2021-07-15,0,14,13.0,0,91,In Print,0.0,0.0,,1.0,4.0,12.0,Low
9781438004891,The Hamster Handbook,DK Other,2015-05-01,0,1,,0,0,No Longer Distributed,0.0,0.0,,0.0,0.0,0.0,Low
9781492688815,Footnotes: The Black Artists Who Rewrote the Rules of the Great White Way,DK Other,2021-06-21,0,1,,0,0,No Longer Distributed,0.0,0.0,,,,,Low
9781492680833,What Does It Mean to Be Safe?: A thoughtful discussion for readers of all ages about drawing healthy boundaries and making safe choices: 0,DK Other,2019-11-01,0,0,,0,0,No Longer Distributed,0.0,0.0,,0.0,0.0,0.0,Low
9781728243269,"Wicked As You Wish: 1 (A Hundred Names for Magic, 1)",DK Other,2021-11-01,0,0,,0,0,No Longer Distributed,0.0,0.0,,0.0,0.0,0.0,Low
9781728200293,"Conventionally Yours: 1 (True Colors, 1)",DK Other,2020-07-02,0,22,22.0,0,61,In Print,0.0,0.0,,1.0,4.0,12.0,Low
9781464201158,"Roman Games: 1 (Plinius Secundus Series, 1)",DK Other,2011-12-30,0,1,,0,0,No Longer Distributed,0.0,0.0,,,,,Low
9781464221071,Somewhere in the Deep,DK Other,2025-01-23,0,32,31.0,0,119,In Print,0.0,0.0,,1.0,4.0,12.0,Low
9781492673156,At the End of Everything: The World Never Wanted Them. They Refuse to Be Forgotten.,DK Other,2022-02-25,0,0,,0,0,No Longer Distributed,0.0,0.0,,0.0,0.0,0.0,Low
9781402277825,If He Had Been with Me,DK Other,2013-05-02,0,0,,0,0,No Longer Distributed,0.0,0.0,,0.0,0.0,6.0,Low
9781492696865,"Make Me Burn: 1 (Turn Up the Heat, 1)",DK Other,2021-06-25,0,1,,0,0,No Longer Distributed,0.0,0.0,,0.0,0.0,0.0,Low
9781728260006,The Chaperone,DK Other,2023-06-06,0,1,,0,0,No Longer Distributed,0.0,0.0,,0.0,0.0,0.0,Low
9781492688228,Lost Island,DK Other,2021-11-05,0,0,,0,0,No Longer Distributed,0.0,0.0,,0.0,0.0,0.0,Low
9781728276380,My Sticker Dress-Up: Fairies,DK Other,2023-06-02,0,3,,0,307,In Print,0.0,0.0,,0.0,0.0,0.0,Low
9781728257921,Survive the Dome,DK Other,2023-03-07,0,1,,0,77,In Print,0.0,0.0,,0.0,0.0,0.0,Low
9781492660897,Mask of Shadows: 1,DK Other,2018-08-03,0,0,,0,3,In Print,0.0,0.0,,0.0,0.0,0.0,Low
9781492662587,Crossing Paths: 2 (Beneath the Wild Sky),DK Other,2025-06-13,0,0,,0,0,NOT YET PUBLISHED,2.0,0.0,,0.0,0.0,0.0,Low
9781492698678,Pirate Nell's Tale to Tell: A Storybook Adventure: 1,DK Other,2020-10-15,0,0,,0,0,No Longer Distributed,0.0,0.0,,0.0,0.0,0.0,Low
9781728254265,No Way Home: Her Dream Trip Is a Living Nightmare,DK Other,2022-10-01,0,0,,0,0,No Longer Distributed,0.0,0.0,,0.0,0.0,0.0,Low
9781728296135,A Girl Like Us: A Novel,DK Other,2025-03-11,0,0,,0,0,No Longer Distributed,1.0,0.0,,0.0,2.0,23.0,High
9781492628262,"In Safe Hands: 4 (Search and Rescue, 4)",DK Other,2016-11-04,0,1,,0,0,No Longer Distributed,0.0,0.0,,,,,Low
9781402237461,"The Killer Book of Infamous Murders: Incredible Stories, Facts, and Trivia from the World’s Most Notorious Murders",DK Other,2011-04-01,0,0,,0,0,No Longer Distributed,0.0,0.0,,0.0,0.0,0.0,Low
9781728281513,Drink Water and Mind Your Business: A Black Woman's Guide to Unlearning the Bs and Healing Your Self-esteem,DK Other,2025-06-13,0,0,,0,0,NOT YET PUBLISHED,0.0,0.0,,0.0,0.0,0.0,Low
9781728248721,Before You Found Me: A Novel,DK Other,2023-09-01,0,1,,0,0,No Longer Distributed,0.0,0.0,,0.0,0.0,0.0,Low
9781728280455,The Things We Make: The Unknown History of Invention from Cathedrals to Soda Cans,DK Other,2024-08-30,0,25,11.5,0,601,In Print,0.0,0.0,,2.0,8.0,24.0,Low
9781728236001,Mia's Life Fan Takeover!,DK Other,2021-04-06,0,37,13.666666666666666,0,0,No Longer Distributed,0.0,0.0,,3.0,9.0,25.0,Low
9781728275437,Baby Animals Trying: A Celebration of First Moments (Animal Celebrations and Milestones),DK Other,2025-01-07,0,2,,0,107,In Print,0.0,0.0,,,,,Low
9781728220215,"Silence in the Shadows: 4 (Black Winter, 4)",DK Other,2020-11-06,0,0,,0,0,No Longer Distributed,0.0,0.0,,0.0,0.0,0.0,Low
9781728281834,Wings Once Cursed & Bound (Mythwoven),DK Other,2023-04-11,0,2,,0,163,In Print,0.0,0.0,,0.0,0.0,0.0,Low
9781492667759,Fish Out of Water,DK Other,2024-02-13,0,3,,0,288,In Print,0.0,0.0,,0.0,0.0,0.0,Low
9781464238451,Most Valuable Playboy: A Friends to Lovers Fake Dating Sports Romance (Ballers and Babes),DK Other,2025-02-18,0,0,0.0,0,1846,NOT YET PUBLISHED,1.0,0.0,,1.0,7.0,26.0,Low
9781728228600,My First 100 Ocean Words (My First STEAM Words),DK Other,2021-01-01,0,3,,0,44,In Print,0.0,0.0,,0.0,0.0,0.0,Low
9781492680161,Cursed,DK Other,2020-06-05,0,2,,0,0,No Longer Distributed,0.0,0.0,,,,,Low
9781464244711,Grin and Beard It (Winston Brothers),DK Other,2025-06-10,0,0,,0,0,NOT YET PUBLISHED,7.0,0.0,,0.0,0.0,5.0,Low
9781464225802,The Most Famous Girl in the World,DK Other,2024-09-17,0,0,,0,0,No Longer Distributed,0.0,0.0,,0.0,0.0,0.0,Low
9781728206998,We Are Lost and Found,DK Other,2020-08-07,0,2,,0,0,No Longer Distributed,0.0,0.0,,0.0,0.0,0.0,Low
9781728268071,2024 I Came. I Saw. I F*cking Conquered. Planner: August 2023-December 2024 (Calendars & Gifts to Swear By),DK Other,2023-09-07,0,0,,0,0,No Longer Distributed,0.0,0.0,,0.0,0.0,0.0,Low
9781728294988,The Wolf of My Eye: 8 (Highland Wolf),DK Other,2025-04-11,0,0,,0,0,No Longer Distributed,1.0,0.0,,0.0,0.0,0.0,Low
9781728231938,"The Crow Rider: 2 (Storm Crow, 2)",DK Other,2021-07-01,0,0,,0,0,No Longer Distributed,0.0,0.0,,0.0,0.0,0.0,Low
9781728262529,"50 Ways to More Calm, Less Stress: Scientifically Proven Ways to Relieve Anxiety and Boost Your Mental Health Using Your Five Senses",DK Other,2024-01-26,0,4,,0,353,In Print,0.0,0.0,,0.0,0.0,0.0,Low
9781464225345,To Catch a Thief (Library of Congress Crime Classics),DK Other,2025-05-01,0,0,,0,0,No Longer Distributed,7.0,0.0,,0.0,0.0,20.0,Low
9781728296784,My Sticker Dress-Up: Pets,DK Other,2024-03-06,0,4,,0,103,In Print,0.0,0.0,,0.0,0.0,1.0,Low
9781883220679,The Dandelion Seed: A picture book of finding strength through nature’s story,DK Other,1997-10-01,0,0,,0,0,No Longer Distributed,0.0,0.0,,0.0,0.0,0.0,Low
9781464231643,"The 30-day Money Cleanse: Take Control of Your Finances, Manage Your Spending, and De-stress Your Money for Good",DK Other,2025-04-04,0,0,,0,0,NOT YET PUBLISHED,1.0,0.0,,0.0,2.0,17.0,High
9781618216663,Parenting Kids With OCD: A Guide to Understanding and Supporting Your Child With OCD: 1,DK Other,2017-10-30,0,4,,0,0,Out of Print,0.0,0.0,,0.0,0.0,0.0,Low
9781728217345,A Gentleman Ought to Know: 4 (The Duke's Estates),DK Other,2023-04-07,0,1,,0,0,No Longer Distributed,0.0,0.0,,0.0,0.0,0.0,Low
9781728229645,When You Give a Rogue a Rebel,DK Other,2021-04-30,0,2,,0,0,No Longer Distributed,0.0,0.0,,0.0,0.0,0.0,Low
9781728256153,Bring Me Your Midnight,DK Other,2023-08-01,0,0,0.0,0,0,No Longer Distributed,0.0,0.0,,1.0,4.0,12.0,High
9781728228754,The Surgeon's Daughter: A Novel,DK Other,2022-06-30,0,0,,0,0,No Longer Distributed,0.0,0.0,,0.0,0.0,0.0,Low
9781641525213,"Super Cool Space Facts: A Fun, Fact-filled Space Book for Kids",DK Other,2019-10-03,0,1,,0,126,In Print,0.0,0.0,,0.0,0.0,0.0,Low
9781728268453,Have You Seen My Sister,DK Other,2023-10-05,0,3,,0,488,In Print,0.0,0.0,,0.0,0.0,0.0,Low
9781728281810,The Book Proposal,DK Other,2023-05-16,0,11,,0,316,In Print,0.0,0.0,,0.0,0.0,0.0,Low
9781492671220,"Where Did We Come From?: A simple exploration of the universe, evolution, and physics",DK Other,2022-03-10,0,3,,0,209,In Print,0.0,0.0,,0.0,0.0,0.0,Low
9798889641148,"Rebel Girls Money Matters: A Guide to Saving, Spending, and Everything in Between",DK Other,2024-03-26,0,58,20.666666666666668,0,1533,In Print,0.0,0.0,,3.0,12.0,32.0,Low
9781641525862,My Sight Words Workbook: 101 High-Frequency Words Plus Games & Activities! (My Workbook),DK Other,2019-10-10,0,0,0.0,0,139,In Print,0.0,0.0,,1.0,4.0,12.0,Low
9781728295091,A Tale of Two Titties: A Writer's Guide to Conquering the Most Sexist Tropes in Literary History,DK Other,2024-08-23,0,12,,0,493,In Print,0.0,0.0,,0.0,0.0,0.0,Low
9781728279190,The Pumpkin Seed's Secret: A Life Cycle Poem (Starting Small),DK Other,2024-08-02,0,15,,0,185,In Print,0.0,0.0,,0.0,0.0,0.0,Low
9781646114467,The Healing Gout Cookbook: Anti-Inflammatory Recipes to Lower Uric Acid Levels and Reduce Flares,DK Other,2020-04-30,0,0,0.0,0,0,Reprinting,0.0,0.0,,8.0,44.0,149.0,High
9781728252254,Last Night at the Hollywood Canteen: A Novel,DK Other,2023-12-07,0,4,,0,0,No Longer Distributed,0.0,0.0,,0.0,0.0,0.0,Low
9781728251875,The Scenic Route: 1 (Beneath the Wild Sky),DK Other,2024-08-30,0,13,,0,313,In Print,0.0,0.0,,0.0,0.0,0.0,Low
9781728270913,Swarm,DK Other,2023-12-07,0,3,,0,156,In Print,0.0,0.0,,0.0,0.0,0.0,Low
9781728290195,Travels of Terror: Strange and Spooky Spots Across America,DK Other,2024-10-17,0,18,,0,101,In Print,0.0,0.0,,0.0,0.0,0.0,Low
9781728294070,The Thirteenth Husband: A Novel,DK Other,2024-09-06,0,2,,0,190,In Print,0.0,0.0,,0.0,0.0,0.0,Low
9781728293905,2025 Own Your Magic Boxed Calendar: 365 Days of Spells and Intentions to Manifest Your Best Witch Life,DK Other,2024-09-01,0,47,43.0,0,72,In Print,0.0,0.0,,1.0,0.0,0.0,Low
9780241649039,"The Complete Instant Pot Cookbook: Innovative Recipes to Slow Cook, Bake, Air Fry and Pressure Cook",DK Life,2023-10-05,0,105,5.705882352941177,0,3049,In Print,0.0,0.0,,17.0,54.0,133.0,Low
9780241315606,"RHS Pests & Diseases: New Edition, Plant-by-plant Advice, Keep Your Produce and Plants Healthy",DK Life,2018-03-01,0,92,17.8,0,936,In Print,0.0,1000.0,2025-01-15,5.0,29.0,112.0,Low
9780241510162,"Australian Women's Weekly Baking: Breads, Cakes, Biscuits, And Bakes",DK Life,2021-08-05,0,14,13.0,0,1227,In Print,0.0,0.0,,1.0,4.0,12.0,Low
9781405359788,"Feeding Your Baby and Toddler: 200 Easy, Healthy, and Nutritious Recipes",DK Life,2010-07-01,0,7,7.0,0,137,In Print,0.0,0.0,,1.0,4.0,12.0,Low
9780241628157,What Would You Do If You Weren't Afraid?: Creating a Meaningful Life in Uncertain Times,DK Life,2023-09-07,0,14,14.0,0,1002,In Print,0.0,0.0,,1.0,4.0,12.0,Low
9780241480441,Healthy Vegan The Cookbook: Vegan Cooking Meets Nutrition Science,DK Life,2021-07-01,0,6,3.0,0,1197,In Print,0.0,0.0,,2.0,5.0,13.0,Low
9780241460191,Grow Compost: Essential Know-how and Expert Advice for Gardening Success,DK Life,2021-06-03,0,5,2.5,0,2147,In Print,0.0,0.0,,2.0,8.0,23.0,Low
9780241531358,Nature Is A Human Right: Why We're Fighting for Green in a Grey World,DK Life,2022-02-03,0,7,7.0,0,4291,In Print,0.0,0.0,,1.0,4.0,12.0,Low
9780241688700,"Your Financial Planner: Review, Plan, Reflect",DK Life,2024-01-04,0,134,17.125,0,2022,In Print,0.0,0.0,,8.0,25.0,65.0,Low
9780241548486,"Australian Women's Weekly Desserts: Achievable, Satisfying Sweet Treats",DK Life,2022-07-07,0,4,,0,3811,In Print,0.0,0.0,,0.0,0.0,0.0,Low
9781409324867,"Boost Your Brain: Switch on your Brain with over 300 Puzzles, Tips, and Teasers",DK Life,2014-01-16,0,0,,0,0,Out of Print,0.0,0.0,,0.0,0.0,0.0,Low
9780241340585,MasterChef The Classics with a Twist,DK Life,2018-10-04,0,0,0.0,0,0,Out of Print,0.0,0.0,,1.0,5.0,20.0,High
9781409386551,The Herb Garden for Cooks,DK Life,2012-04-02,0,0,0.0,0,0,Out of Print,0.0,0.0,,1.0,4.0,12.0,High
9780241455852,The Birthday Book: What the day you were born says about you,DK Life,2020-11-05,0,6,6.0,0,683,In Print,0.0,0.0,,1.0,0.0,2.0,Low
9780241275337,"Homemade Christmas: Create your own gifts, cards, decorations, and bakes",DK Life,2016-10-03,0,10,,0,0,Out of Print,0.0,0.0,,0.0,0.0,0.0,Low
9780241458501,Holistic Hypnobirthing: Mindful Practices for a Positive Pregnancy and Birth,DK Life,2021-02-04,0,15,7.0,0,1290,In Print,0.0,0.0,,2.0,8.0,24.0,Low
9780241510407,It's Your Loss: Living With Grief Is Hard. We Hope This Book Will Help.,DK Life,2021-09-23,0,2,,0,695,In Print,0.0,0.0,,0.0,0.0,0.0,Low
9780241459751,"RHS The Tree in My Garden: Choose One Tree, Plant It - and Change the World",DK Life,2022-09-08,0,24,24.0,0,5652,In Print,0.0,0.0,,1.0,4.0,12.0,Low
9780241529577,The Last Bite: A Whole New Approach to Making Desserts Through the Year,DK Life,2022-05-05,0,13,13.0,0,1338,In Print,0.0,0.0,,1.0,4.0,9.0,Low
9780241329290,"Grains As Mains: Modern Recipes using Ancient Grains, From Gluten-Free Breakfasts to Vegetarian Dinners",DK Life,2017-11-02,0,0,,0,0,Reprint under Review,0.0,0.0,,0.0,0.0,0.0,Low
9780241648759,Grow Lawns: Essential Know-how and Expert Advice for Gardening Success,DK Life,2024-03-07,0,4,,0,1195,In Print,0.0,0.0,,0.0,0.0,0.0,Low
9780241286463,Power Bowls: All You Need in One Healthy Bowl,DK Life,2016-10-03,0,0,,0,0,Out of Print,0.0,0.0,,0.0,0.0,0.0,Low
9780241336656,RHS How To Garden When You're New To Gardening: The Basics For Absolute Beginners,DK Life,2018-02-22,0,12,11.0,0,0,Out of Print,0.0,0.0,,1.0,13.0,48.0,High
9780241726082,The Sewing Book (New Edition),DK Life,2025-02-27,0,0,0.0,0,3330,NOT YET PUBLISHED,10.0,0.0,,3.0,49.0,186.0,Low
9780241305898,"Get Strong For Women: Lift Heavy, Train Hard, See Results",DK Life,2018-01-04,0,1,0.3333333333333333,0,0,Out of Print,0.0,0.0,,3.0,16.0,54.0,High
9780241412374,The Little Book of Baby Massage: Use the Power of Touch to Calm Your Baby,DK Life,2020-01-02,0,2,2.0,0,0,Out of Print,0.0,0.0,,1.0,8.0,24.0,High
9780241510414,All Up In My Space: How to Decorate With Feeling,DK Life,2023-07-06,0,4,,0,2481,In Print,0.0,0.0,,0.0,0.0,3.0,Low
9780241458525,"Natural Menopause: Herbal Remedies, Aromatherapy, CBT, Nutrition, Exercise, HRT...for Perimenopause, Menopause, and Beyond",DK Life,2021-03-04,0,120,118.0,0,798,In Print,0.0,0.0,,1.0,4.0,19.0,Low
9780241726099,"DIY: Repair, Renovate and Decorate",DK Life,2025-03-06,0,0,0.0,0,2669,NOT YET PUBLISHED,3.0,3500.0,2025-01-27,1.0,18.0,65.0,Low
9780241332559,"Ginspiration: Infusions, Cocktails",DK Life,2017-11-02,0,7,,0,935,In Print,0.0,0.0,,0.0,0.0,0.0,Low
9780241229460,"Cushions, Curtains and Blinds Step by Step: 25 Soft-Furnishing Projects for the Home",DK Life,2017-02-01,0,0,0.0,0,0,Reprint under Review,0.0,0.0,,8.0,30.0,87.0,High
9780241636237,RHS How to Garden When You're New to Gardening: The Basics for Absolute Beginners,DK Life,2024-01-04,0,64,64.0,0,2381,In Print,0.0,0.0,,1.0,8.0,24.0,Low
9780241544013,To Stand And Stare: How to Garden While Doing Next to Nothing,DK Life,2023-02-02,0,13,7.0,0,1925,In Print,0.0,0.0,,2.0,8.0,24.0,Low
9780241255636,Cocktails: The Art of Mixing Perfect Drinks,DK Life,2016-11-01,0,3,,0,726,In Print,0.0,0.0,,0.0,0.0,0.0,Low
9780241598436,Your Gardening Year 2023: A Monthly Shortcut to Help You Get the Most from Your Garden,DK Life,2022-09-01,0,1,,0,0,Out of Print,0.0,0.0,,0.0,0.0,0.0,Low
9780241302118,The Tool Book: A Tool-Lover's Guide to Over 200 Hand Tools,DK Life,2018-05-03,0,34,31.0,0,112,In Print,0.0,0.0,,1.0,4.0,14.0,Low
9781405336840,The Essential First Year: What Babies Need Parents to Know,DK Life,2010-04-21,0,1,1.0,0,0,Reprint under Review,0.0,0.0,,1.0,4.0,12.0,High
9780241561553,Hortus Curious: Discover the World's Most Weird and Wonderful Plants and Fungi,DK Life,2022-10-06,0,16,15.0,0,4962,In Print,0.0,0.0,,1.0,3.0,11.0,Low
9780241484302,Surprise! It's Gluten-free!: Over 100 Sweet And Savoury Recipes That Taste Like The Real Thing,DK Life,2021-06-03,0,6,,0,3780,In Print,0.0,0.0,,0.0,0.0,0.0,Low
9780241242278,Supercraft: Easy Projects for Every Weekend,DK Life,2016-03-01,0,1,,0,0,Out of Print,0.0,0.0,,0.0,0.0,0.0,Low
